Chapter Number,ChapterName,SubChapterName,Classification,QuestionNumber,QuestionText,Option1,Option2,Option3,Option4,Image?,Answer,AnswerDescription,QuestionType
3,Heat,Concept Application-Level-1,MCQ,26,"A hot body at temperature θ~1* is mixed with a cold body at temprature θ~2* both having the same heat capacity, such that the rise in temperature of the cold body is equal to the fall in temperature of the hot body. The resultant temperature θ is",a,b,c,d,CH-3-26-ROW-112,a,,MCQ
3,Heat,Concept Application-Level-1,MCQ,27,Snow balls are formed due to,melting of ice,freezing of atmospheric moisture,regelation,sublimation,,c,,MCQ
3,Heat,Concept Application-Level-1,MCQ,28,"A substance of mass m~1* with specific heat capacity s~1* and initial temperature θ~1* is mixed with another substance of mass m~2*, specific heat capacity s~2* and initial temperature θ~2*, respectively. Then, their equilibrium temperature is ______ (take θ~1* > θ~2*)",A,B,C,D,CH-3-28-ROW-114,d,,MCQ
3,Heat,Concept Application-Level-1,MCQ,29,"Heat gained by 1 g of water when heated from 0^0&C to 100^0&C is
(Specific heat capacity of water = 1 cal g^-1&C ^0&C^-1&)",4200 cal,4.2 cal,100 cal,1 cal,,c,,MCQ
3,Heat,Concept Application-Level-1,MCQ,30,"Two bodies of masses 50 g and 100 g, have their water equivalents as 10 g and 20 g, respectively. The values of their specific heat capacities are _____ cal g^−1& ^0&C^−1& and _______cal g^−1& ^0&C^−1&.",a,b,c,d,CH-3-30-ROW-116,a,,MCQ
3,Heat,Concept Application-Level-1,MCQ,31,"Arrange the following steps in the proper order to explain how a sea breeze occurs, near coastal regions.
(a) The temperature of land rises rapidly as compared to sea, because the specific heat capacity of land is five times less than that of water.
(b) Due to the low pressure over the land mass, the cool air over the sea starts blowing towards the land.
(c) The sun shines equally on the land mass and sea, giving equal amount of heat energy to both.
(d) The air above the land becomes hot and light, rises up, and hence creates the low pressure over the land.",a d c b,c d a b,c a b d,c a d b,,d,,MCQ
3,Heat,Concept Application-Level-1,MCQ,32,Linear expansion of a substance depends upon its,initial length.,Change in temperature,nature of the material,All of these.,,d,,MCQ
3,Heat,Concept Application-Level-1,MCQ,33,"The area of cross-sections of three metal rods of the equal length and made of the same materials are A~1*, A~2* and A~3*, respectively. When heated through the same change in temperature, their linear expansions are found to be l~1*, l~2* and l~3*, respectively Which among the following is the correct relation between l~1*, l~2* and l~3*?",l~1* = l~2* = l~3*,l~1* > l~2* > l~3*,l~1* < l~2* < l~3*,l~1* = l~2* < l~3*,,a,,MCQ
3,Heat,Concept Application-Level-1,MCQ,34,The coefficient of linear expansion α of steel is 11 × 10^–6& ^0&C^–1& = Then α_____ × 10^–6& ^0&F^–1&,6.11,19.8,11,43,,a,,MCQ
3,Heat,Concept Application-Level-1,MCQ,35,"A copper wire is bent as shown in the figure. When its temperature is increased, the distance between A and B _____.",decreases,increases,remains same,increases or decreases depending up on its initial temperature,CH-3-35-ROW-121,b,,MCQ
3,Heat,Concept Application-Level-1,MCQ,36,The coefficient of linear expansion α is ______ that of the coefficient of areal expansion.,double of,triple of,half of,equal to,,c,,MCQ
3,Heat,Concept Application-Level-1,MCQ,37,"The coefficient of linear and areal expansion cannot be defined for liquids, as liquids do not have a definite ______.",volume,shape,density,specific heat capacity,,b,,MCQ
3,Heat,Concept Application-Level-1,MCQ,38,"Anomalous behaviour of water can be demonstrated with the help of Hope’s apparatus. Arrange the following steps of changes taking place in Hopes apparatus in the proper sequence.
(a) The temperature shown by the lower thermometer reaches to 4 ^0&C and remains constant at 4 ^0&C.
(b) Water freezes into ice at 0 ^0&C, and the layer of ice is formed at the top surface because the density of ice is less than that of water.
(c) The initial temperature of water is maintained at 10 ^0&C. The temperature of water begins to fall due to the freezing mixture at the centre and it contracts.
(d) As temperature of water falls below 4 ^0&C, water expands instead of contracting and its density decreases. So, water goes up from the centre portion.
(e) As density increases, the cold water goes to the bottom. The temperature shown by the lower thermometer falls.
(f) The temperature of water at the top of the vessel begins to fall till 0 ^0&C as shown by the upper thermometer.
(g) Being a bad conductor of heat, ice prevents the loss of heat from water below it into the surroundings.",c e b f a g d,c e a d f b g,c e a f d g b,c b e g d a f,,b,,MCQ
3,Heat,Concept Application-Level-1,MCQ,39,"A pendulum clock takes exactly 2 s to perform one oscillation at 20^0&C. If the pendulum clock is made of copper, then the pendulum ________ at 40^0&C.",gains the time,losses the time,does not oscillate,brakes,,b,,MCQ
3,Heat,Concept Application-Level-1,MCQ,40,Steam is used in external combustion engine as working medium because of its,high specific heat capacity.,high thermal capacity.,high latent heat of vaporization.,low liquefaction point (B.P).,,c,,MCQ
4,Light,Concept Application-Level-1,True - False,1,Interference takes place whenever two or more wave motions combine in space.,,,,,,0,,TF
4,Light,Concept Application-Level-1,True - False,2,"In the minimum deviation position of a prism, the refracted ray is always parallel to its base.",,,,,,0,,TF
4,Light,Concept Application-Level-1,True - False,3,A person suffering from myopia cannot see distant objects clearly.,,,,,,1,,TF
4,Light,Concept Application-Level-1,True - False,4,The focal length of a given lens depends on the surrounding medium.,,,,,,1,,TF
4,Light,Concept Application-Level-1,True - False,5,Prismatic periscopes use the principle of total internal reflection.,,,,,,1,,TF
4,Light,Concept Application-Level-1,True - False,6,A dentist uses a convex mirror to view the inner parts of a patient’s mouth.,,,,,,0,,TF
4,Light,Concept Application-Level-1,True - False,7,The solar spectrum in general is an absorption spectrum.,,,,,,1,,TF
4,Light,Concept Application-Level-1,Fill in the blanks,8,A yellow coloured dress would appear to be _________ when viewed through a green filter.,,,,,,black,,FIB
4,Light,Concept Application-Level-1,Fill in the blanks,9,"Due to ________ of laser, large energy can be concentrated into an extremely small bandwidth.",,,,,,high monochromatic nature,,FIB
4,Light,Concept Application-Level-1,Fill in the blanks,10,"The combination of a convex lens of power + 2 D and a concave lens of power –2 D, acts as a __________",,,,,,glass salb,,FIB
4,Light,Concept Application-Level-1,Fill in the blanks,11,The minimum length of a plane mirror required to view the full image of a person 6 feet tall is ______.,,,,,,3 feet,,FIB
4,Light,Concept Application-Level-1,Fill in the blanks,12,"A bird is flying 12 m above the surface of a pond. The apparent position of the bird as viewed by a fish 1m below the surface is __________ (~a*μ~w* =4/3)     
  ",,,,,,15 m ,,FIB
4,Light,Concept Application-Level-1,Fill in the blanks,13,"An object is placed on the principal axis of a concave mirror at a distance of 60 cm. If the focal length of the concave mirror is 40 cm, then the magnification obtained is equal to __________",,,,,,2,,FIB
4,Light,Concept Application-Level-1,Fill in the blanks,14,The power of a biconcave lens having focal length 25 cm is _____.,,,,,,-4D,,FIB
4,Light,Concept Application-Level-1,Match the following,15,Match the entries in Column A with appropriate ones from Column B.,"A:d, B:g, C:I, D:h, E:a, F:j, G:b, H:f, I:e, J:c","A:d, B:g, C:I, D:h, E:a, F:j, G:b, H:f, I:c, J:e","A:d, B:g, C:I, D:h, E:a, F:b, G:j, H:f, I:c, J:e","A:g, B:d, C:I, D:h, E:a, F:j, G:b, H:f, I:c, J:e",CH-4-15-ROW-141,B,,MCQ
4,Light,Concept Application-Level-1,MCQ,16,A mirage takes place due to _________.,I)reflection,II) refraction,III) total internal reflection,IV) Both (II) and (III),,d,,MCQ
4,Light,Concept Application-Level-1,MCQ,17,Raman effect is an example of _____.,coherent scattering of light.,incoherent scattering of light,coherent interference of light,incoherent interference of light,,b,,MCQ
4,Light,Concept Application-Level-1,MCQ,18,The optical phenomenon which Newton’s theory of light failed to explain is _____.,interference,polarization,diffraction,All of these three,,d,,MCQ
4,Light,Concept Application-Level-1,MCQ,19,An observer moves towards a stationary plane mirror at a speed of 4 m s^−1&. The speed of image with respect to mirror is _________.,4 m s^−1& towards the mirror,8 m s^−1& towards the mirror,4 m s^−1& away from the mirror,8 m s^−1& away from the mirror,,a,,MCQ
4,Light,Concept Application-Level-1,MCQ,20,The process in which the electrons in the excited atoms are released on their own from their higher energy state to the ground state is called _____.,forced emission,population inversion,spontaneous emission,None of these,,c,,MCQ
4,Light,Concept Application-Level-1,MCQ,21,"The refractive index of diamond is 2.4. If the velocity of light in air or vacuum is 3 × 108 m s^−1&, then the velocity of light in diamond is ______ × 108 m s^−1&.",1.25,12.5,0.8,125,,a,,MCQ
4,Light,Concept Application-Level-1,MCQ,22,A convex mirror is used,by a dentist,for shaving,as a rear view mirror in vehicles,as a light reflector for obtaining a parallel beam of light.,,c,,MCQ
4,Light,Concept Application-Level-1,MCQ,23,"When an equilateral glass prism is in minimum deviation position
(A) the refracted ray is parallel to the base of the prism.
(B) the angle of incidence is equal to the angle of emergence",Only A is true,Only B is true,Both A and B are true,Both A and B are false,,c,,MCQ
4,Light,Concept Application-Level-1,MCQ,24,"The colour of a green leaf, when white light passing through a yellow filter is incident on it, is __________.",Black,yellow,red,green,,d,,MCQ
4,Light,Concept Application-Level-1,MCQ,25,Spectrometer is used to measure ________.,angle of prism,refractive index of material of a prism,the dispersion,All of these,,d,,MCQ
4,Light,Concept Application-Level-1,MCQ,26,The expression for the magnification of a spherical mirror in terms of focal length (f) and the distance of the object from mirror (u) is,a,b,c,d,CH-4-26-ROW-152,d,,MCQ
4,Light,Concept Application-Level-1,MCQ,27,"According to Newton, different colours of light are due to the difference in ______ of the corpuscles.",mass,nature,Shape,size,,d,,MCQ
4,Light,Concept Application-Level-1,MCQ,28,"If the speed of light in medium – 1 and medium – 2 are 2.5 × 108 m s^−1& and 2 × 10^8& m s^−1& , respectively, then the refractive index of medium – 1 with respect to medium – 2 is __________.",3/2.5,2/2.25,2.5/3,2.5/2,,b,,MCQ
4,Light,Concept Application-Level-1,MCQ,29,"A coin is placed at the bottom of a swimming pool. To obtain a vertical shift of 20 cm of the image of the coin, the required height of the water column is _____ μ~water* = 4/3.",20 cm,2 m,80 m,80 cm,,d,,MCQ
4,Light,Concept Application-Level-1,MCQ,30,The apparent vertical shift of the image of a coin placed at the bottom of a water tank having constant depth of water is proportional to _________.,m,1/m,m - 1,m + 1,,b,,MCQ
4,Light,Concept Application-Level-1,MCQ,31,"Facts about the light
(a) Light is a form of electromagnetic radiation and a non-mechanical wave.
(b) Light waves do not require a material as a medium for propagation.",Only A is true,Only B is true,Both A and B are true,Both A and B are false,,c,,MCQ
4,Light,Concept Application-Level-1,MCQ,32,Find the correct statements related to the image formed by the plane mirror form the given below.,"The image formed is laterally inverted, virtual and erect.",The size of the image is equal to the size of the object.,The object distance from the plane mirror is equal to the image distance from the plane mirror.,All of these.,,d,,MCQ
4,Light,Concept Application-Level-1,MCQ,33,When a light ray is directed towards the principal focus of a concave mirror,real image is formed,a dmonished image is formed,inverted image is formed,All of these,,d,,MCQ
4,Light,Concept Application-Level-1,MCQ,34,"An object is placed in front of a spherical mirror at a distance of 20 cm from it.A virtual image is formed at a distance of 30 cm from it. Arrange the following steps in the proper sequence to determine the nature and focal length of the mirror.
(a) Substitute the values of v and u in the mirror formula 1/f = 1/u + 1/v
(b) Check whether the focal length obtained is a negative or a positive integer.
(c) Decide whether the mirror is a convex or a concave mirror based on the sign of the focal length obtained.
(d) Assign proper signs to the object distance and image distance by using the sign convention.
(e) Obtain the value of focal length.",d a e b c,a d b e c,a b d e c,b d c a b,,a,,MCQ
4,Light,Concept Application-Level-1,MCQ,35,Total reflecting prisms are prism.,right angled.,acute angled isosceles,right angled isosceles,obtuse angled isosceles,,c,,MCQ
4,Light,Concept Application-Level-1,MCQ,36,The final image formed by the refracting periscope is than the reflecting periscope.,brither,sharp,dimmer,Both A and B,,d,,MCQ
4,Light,Concept Application-Level-1,MCQ,37,"Light is made to travel from medium 1 to medium 3 through medium 2 as shown in figure. If μ~1* , μ~2* and μ~3* a are the refractive indices of first, second and third media and i~2* > i~1*, then",a,b,c,d,CH-4-37-ROW-163,d,,MCQ
4,Light,Concept Application-Level-1,MCQ,38,What are the factors that determine the angle of deviation in a prism?,angle of incidence,wave length,angle of the prism,All of these,,d,,MCQ
4,Light,Concept Application-Level-1,MCQ,39,Astigmatism can be rectified by a suitable ......... Lens,concave,convex,cylindrical,None of these,,c,,MCQ
4,Light,Concept Application-Level-1,MCQ,40,Human eye has maximum luminous efficiency to ......... light.,yellow,red,voilet,green,,d,,MCQ
4,Light,Concept Application-Level-1,MCQ,41,"Arrange the proper sequence of the steps to determine the refractive index of a prism by using angle of minimum deviation method.
(a) Fix a white sheet of paper on a drawing board.
(b) Draw the outer line of the prism by placing its triangular cross-section (ABC) on the paper,
(c) Draw a line which makes a certain angle with the normal. This is the incident ray.
(d) Mark a point on one of the sides and draw a normal at that point.
(e) Fix two pins P and Q on this line.
(f) Place the prism inside its outer line and observe the pins P and Q from the other side of the prism.
(g) Fix two more pins R and S on the other sides such that the images of the pins P and Q, R and S are in a straight line.
(h) Join the points R and S and the line segments PQ and RS. 
(i) Remove the pins and the prism from the paper.
(j) Draw a normal XY where the line segment RS meets the side BC.
(k) Draw a graph by taking the angle of incidence and angle of deviation along the X and Y axes, respectively.
(i) Extend line segments PQ and RS and determine the angle between them. This is known as the angle of deviation.
(m) Determine refractive index as μ = (A + D~m*/2)/sin(A/2)  
(n) Repeat the experiment for different angles of incidence and in each case, determine the angle of deviation.
(o) Determine angle (A) between the refracting surfaces of the prism. (p) Determine the minimum value of angle of deviation (D~m*).",a b c e d g I h j k l m o n p,a b d c e f g h I j l k o n p m,b a c d e j k h I j m l n o p,a b d c e f g l h k m I p o j,CH-4-41-ROW-167,b,,MCQ
4,Light,Concept Application-Level-1,MCQ,42,"Find out the correct option from the following.
(a) The magnification is positive for all virtual images and is negative for all real images.
(b) The magnification of concave lens and convex mirror is always positive where as the magnification of convex lens and concave mirror can be positive or negative depending on the position of the object before the lens.",Only A is true,Only B is true,Both A and B are true,Both A and B are false,,c,,MCQ
4,Light,Concept Application-Level-1,MCQ,43,Find the incorrect statements related to the rainbow,The rainbow is formed in the same direction to the position of the sun.,When the light rays undergo dispersion and total internal reflection the water droplets present in the atmosphere forms rainbow.,A rainbow is formed in the shape of circle.,When light rays undergo one internal reflection and two refractions produce primary rainbow whereas two internal reflections and two refractions produces secondary rainbow.,,a,,MCQ
4,Light,Concept Application-Level-1,MCQ,44,Choose the incorrect option from the following options:,"When a monochromatic light is passed through organic liquid like benzene, toluene, etc. it results in the formation of the scattered light. Which consists of wavelengths of frequencies higher and lower that of incident monochromatic light also that of the incident light.",Incident scattering is a type of scattering in which the scattered light consists of frequencies other than those of the incident light.,The intensity of the scattered light in a medium is inversely proportional to the fourth power of the wavelength.,Rayleigh scattering is called incoherent scattering and Raman scattering is coherent scattering,,d,,MCQ
4,Light,Concept Application-Level-1,MCQ,45,"A student performs an experiment to study the nature of the image formed by a convex lens. Arrange the steps in the proper sequence.
a)  Place the lens on a V-shaped stand.
b) Place the object at 2F~1*.
c) Place the object between 2F~1* and F~1*.
d) Determine the focal length of the lens by focusing the lens to a distant object like a tree.
(e) Adjust the position of the screen behind the lens to obtain a clear image and study the nature of the image.
(f) Mark the positions of F~1*, 2F~1*, F~2* and 2F~2*.
(g) Focus the lens to a distant object like a tree.
(h) Place the object just behind 2F~1*.
(i) Place the object at F~1*.
(j) Place the object between F~1* and optic centre of the lens and observe that the image formed is virtual.",a f d h e g e b e c e e j,b a f h e g c c j,a d f g e h e b e c e I e j,a d f g e h e c e b e j e,,c,,MCQ
5,Hydrostatics,Concept Application-Level-1,True - False,1,A floating body is said to be in stable equilibrium if its metacentre coincides with the centre of gravity.,,,,,,0,,TF
5,Hydrostatics,Concept Application-Level-1,True - False,2,Hydraulic press works on the principle of Bramah’s press.,,,,,,0,,TF
5,Hydrostatics,Concept Application-Level-1,True - False,3,The principle of working of a hydrometer is based on the ‘law of floatation’.,,,,,,1,,TF
5,Hydrostatics,Concept Application-Level-1,True - False,4,The magnitude of pressure measured in SI system is greater than that measured in CGS system.,,,,,,1,,TF
5,Hydrostatics,Concept Application-Level-1,True - False,5,The upward thrust exerted on the body by a liquid acts vertically upwards through the centre of gravity of the displaced liquid.,,,,,,1,,TF
5,Hydrostatics,Concept Application-Level-1,True - False,6,The vertical height of the mercury column in a barometer remains unaffected even if the tube is tilted.,,,,,,1,,TF
5,Hydrostatics,Concept Application-Level-1,True - False,7,Hare’s apparatus works on Archimedes principle,,,,,,0,,TF
5,Hydrostatics,Concept Application-Level-1,Fill in the blanks,8,"For greater mechanical advantage, the diameter of the press piston of a hydraulic lift must be ____ the diameter of the pump piston.",,,,,,greater than,,FIB
5,Hydrostatics,Concept Application-Level-1,Fill in the blanks,9,"A solid when immersed in water displaces half a litre of water. The same solid floats with three fourth of its volume below the surface of a given oil and displaces 800 g of oil. Then the relative density of the
body and the oil are ___________ and __________, respectively.",,,,,,1.6 and 2.15,,FIB
5,Hydrostatics,Concept Application-Level-1,Fill in the blanks,10,"When a truck is loaded, heavy objects should be placed at __________.",,,,,,bottom,,FIB
5,Hydrostatics,Concept Application-Level-1,Fill in the blanks,11,The readings on a variable immersion hydrometer are marked in increasing order from _______ to ________ on its stem.,,,,,,top and bottom,,FIB
5,Hydrostatics,Concept Application-Level-1,Fill in the blanks,12,"Hand pump lifts the underground water, making use of _______.",,,,,,atmospheric pressure,,FIB
5,Hydrostatics,Concept Application-Level-1,Fill in the blanks,13,"The fraction of volume of a floating body inside water, gives __________ of the body.",,,,,,relative density,,FIB
5,Hydrostatics,Concept Application-Level-1,Fill in the blanks,14,"The densities of two liquids are in the ratio of 1 : 3 and their volumes are in the ratio of 2 : 1. If the liquids are filled inside two identical containers, the ratio of pressure exerted by them at the bottom of the
containers is __________.",2 : 3,2 : 2,1 : 3,None of these,,A,,MCQ
5,Hydrostatics,Concept Application-Level-1,Match the following,15,Match the entries in Column A with appropriate ones from Column B.,"A:c, B:b, C:e, D:g, E:I, F:h, G:d, H:f, I:a","A:c, B:b, C:e, D:g, E:I, F:h, G:d, H:a, I:f","A:b, B:c, C:e, D:g, E:I, F:h, G:d, H:f, I:a","A:c, B:b, C:e, D:g, E:I, F:d, G:h, H:f, I:a",CH-5-15-ROW-186,A,,MCQ
5,Hydrostatics,Concept Application-Level-1,MCQ,16,"If a block of wood is floating in a river water, then the apparent weight of the floating block is",equal than weight of the displaced water,zero,greater than the weight of the displaced water,equal to the actual weight of the block,,b,,MCQ
5,Hydrostatics,Concept Application-Level-1,MCQ,17,"When the left arm of a mercury manometer is connected to a cylinder filled with a gas, the level of the mercury in the right arm rises by 2 cm. If the pressure of the gas in the container is 110160 Pa, the atmospheric pressure is __________ cm of Hg. (Take g = 10 m s^-2&)",79,85,77,81,,c,,MCQ
5,Hydrostatics,Concept Application-Level-1,MCQ,18,A test tube of mass ‘m’ sinks upto mark ‘X’ in water and the same test tube sinks below the mark ‘X’ in a given liquid. Then the density of water is,less than the density of the given liquid.,more than the density of the given liquid.,equal to the density of the given liquid.,product of depths of immersion in water and the given liquid.,,a,,MCQ
5,Hydrostatics,Concept Application-Level-1,MCQ,19,"When a lactometer is used in a given sample of milk ‘A’, it floats in the milk such that half of the length of its stem is immersed in the milk. When it is used in another sample of milk ‘B’, the length of the
stem immersed in the milk is one fourth of the total length. Then, which of the following statement(s) is(are) true?
(A) Water content in A is more than that in B.
(B) Density of the sample A is less than the density of the sample B.","A is true, but B is false",A and B are false,A and B are true,A is false but B is true,,c,,MCQ
5,Hydrostatics,Concept Application-Level-1,MCQ,20,"Find the odd choice among the given ones.
The weight of the floating body is equal to the",weight of the displaced liquid.,buoyant force acting on the floating body.,the weight of the liquid that occupies the portion of the volume of the body that is inside the liquid.,the weight of the liquid whose volume is equal to the volume of the part of the body that is above the liquid surface.,,d,,MCQ
5,Hydrostatics,Concept Application-Level-1,MCQ,21,The pressure at a point inside a liquid is directly proportional to ______.,the depth of the point below the free surface,the density of the fluid,acceleration due to gravity,All of these,,d,,MCQ
5,Hydrostatics,Concept Application-Level-1,MCQ,22,"The mercury level in a simple barometer falls gradually, at constant temperature indicates that",weather gradually changes to summer.,weather gradually changes to rainy.,weather changes to an anti-cyclone one.,weather gradually changes to winter,,b,,MCQ
5,Hydrostatics,Concept Application-Level-1,MCQ,23,A plastic ball moves from the bottom of a container filled with water to the top. Then,its velocity increases,its acceleration remains same,its velocity remains same,both (a) and (b),,d,,MCQ
5,Hydrostatics,Concept Application-Level-1,MCQ,24,"A body is floating in a given liquid with half of its volume above the surface of the liquid. If the body is slightly pushed into the liquid, then the body",sinks in the liquid and settles at the bottom,come back to its position after some time.,"starts oscillating in vertical direction, with constant amlitude.",it jumps into the air and falls on the liquid.,,b,,MCQ
5,Hydrostatics,Concept Application-Level-1,MCQ,25,"A block of wood floats separately in river water and then in ocean water. Then, the weight of the displaced river water is",equal to the weight of the displaced ocean water.,less than the weight of the displaced ocean water.,more than the weight of the displaced ocean water.,not dependent on the density of the wooden block.,,a,,MCQ
5,Hydrostatics,Concept Application-Level-1,MCQ,26,"In pressure cooker, the food is cooked faster, because the boiling point of water in the cooker ___.",is above 100^0&C,is below 100^0&C,is equal to 100^0&C,depends upon the amount of the steam/water present inside the cooker,,a,,MCQ
5,Hydrostatics,Concept Application-Level-1,MCQ,27,Choose the wrong statement among the following.,Weight of a body measured by using a spring balance in air is its apparent weight.,Apparent weight of a floating body varies with the density of the liquid.,Volume of a floating body is equal to the volume of the liquid displaced by it,None of these,,c,,MCQ
