Chapter Number,ChapterName,SubChapterName,Classification,QuestionNumber,QuestionText,Option1,Option2,Option3,Option4,Image?,Answer,AnswerDescription,QuestionType
8,Electromagnetism,Concept Application-Level-1,Fill in the blanks,14,An emf is induced in a coil when __________ linked with it changes.,,,,,,the magnetic flux,,FIB
8,Electromagnetism,Concept Application-Level-1,Match the following,15,Match the entries in Column A with appropriate ones from Column B.,"A:c, B:I, C:e, D:b, E:h, F:a, G:d, H:g, I:f, J:j","A:i, B:c, C:e, D:b, E:h, F:a, G:d, H:f, I:g, J:j","A:c, B:I, C:e, D:b, E:h, F:a, G:d, H:f, I:g, J:j","A:c, B:I, C:e, D:b, E:h, F:d, G:a, H:f, I:g, J:j",CH-8-15-ROW-305,C,,MCQ
8,Electromagnetism,Concept Application-Level-1,MCQ,16,A transformer,converts AC to DC,converts DC to AC,increases or decreases (step up or step down) AC voltage,increases or decreases (step up or step down) DC voltage.,,c,,MCQ
8,Electromagnetism,Concept Application-Level-1,MCQ,17,"In an AC generator, maximum number of lines of force pass through the coil when the angle between the plane of coil and lines of force is ________.",0^0&,60^0&,30^0&,90^0&,,d,,MCQ
8,Electromagnetism,Concept Application-Level-1,MCQ,18,Magnetic induction field due to a short bar magnet on its equatorial line at a certain distance is B. Its value at the same distance on the axial line is _____.,2B,B/2,3B,B/3,,a,,MCQ
8,Electromagnetism,Concept Application-Level-1,MCQ,19,Magnetic field inside the solenoid is_______.,radial,uniform,Both (a) and (b),circular,,b,,MCQ
8,Electromagnetism,Concept Application-Level-1,MCQ,20,A step down transformer steps up _________ and steps down ________.,"current, voltage","voltage, current","power, energy","voltage, power",,a,,MCQ
8,Electromagnetism,Concept Application-Level-1,MCQ,21,The power of a DC motor can be increased by,increasing the area of the cross section of the coil.,increasing the current flowing through the coil.,laminating the soft iron core.,All of the above,,d,,MCQ
8,Electromagnetism,Concept Application-Level-1,MCQ,22,"Keeping the distance between two magnetic poles constant, if the two poles are connected by an iron rod, the force between the two poles _____.",increases,decreases,remains same,None of these,,a,,MCQ
8,Electromagnetism,Concept Application-Level-1,MCQ,23,"In a suspension type of moving coil galvanometer, the couple developed in the suspension wire and the loose spring is called a_______.",deflecting couple,restoring couple,twisting couple,None of these,,b,,MCQ
8,Electromagnetism,Concept Application-Level-1,MCQ,24,The right hand thumb rule is used to find,force on a charged particle passing through the magnetic field.,force on a current carrying conductor placed in a magnetic field.,direction of induced current.,direction of B around a current carrying straight conductor.,,d,,MCQ
8,Electromagnetism,Concept Application-Level-1,MCQ,25,"Looking from one side towards the face of a coil, the current in it flows in clockwise direction. On looking from the opposite side towards the second face of the coil, the current flows in",anti-clockwise direction and this face represents the south pole.,clockwise direction and this face represents the north pole.,anticlockwise direction and this face represents the north pole.,clockwise direction and this face represents the south pole.,,c,,MCQ
8,Electromagnetism,Concept Application-Level-1,MCQ,26,The relative permeability of a paramagnetic substance is _____.,much more than one,slightly more than one,less than one but greater than zero,zero.,,b,,MCQ
8,Electromagnetism,Concept Application-Level-1,MCQ,27,Ferromagnetic substances achieve a high degree of magnetic alignment due to the effect known as ____.,pole swapping,exchange coupling,magnetic poling,None of these,,b,,MCQ
8,Electromagnetism,Concept Application-Level-1,MCQ,28,An AC generator can be converted into DC generator by replacing _____.,armature with coil,concave magnets with horse shoe magnet,slip rings with split rings,All of the above,,c,,MCQ
8,Electromagnetism,Concept Application-Level-1,MCQ,29,Magnetic permeability is the ratio of,magnetic induction to susceptibility,magnetic induction to magnetizing field.,magnetizing field to magnetic induction.,magnetizing field to susceptibility.,,b,,MCQ
8,Electromagnetism,Concept Application-Level-1,MCQ,30,"When a piece of iron is placed in a changing magnetic field, it gets heated due to flow of _____.",Eddy current,Faraday’s current,Fleming’s current,None of these,,a,,MCQ
8,Electromagnetism,Concept Application-Level-1,MCQ,31,The magnetic induction field B around a current carrying straight conductor is,perpendicular to the current.,parallel to the current.,opposite to the direction of flow of current.,None of these.,,a,,MCQ
8,Electromagnetism,Concept Application-Level-1,MCQ,32,_______ is used to make permanent magnets.,Soft iron,Steel,Nichrome,Copper,,b,,MCQ
8,Electromagnetism,Concept Application-Level-1,MCQ,33,A transformer works with,AC voltages only.,DC voltages only.,Both (a) and (b).,None of these,,a,,MCQ
8,Electromagnetism,Concept Application-Level-1,MCQ,34,Eddy currents are produced in a metallic conductor when,the magnetic flux linked with it changes,it is placed in a changing magnetic field.,it is placed in a magnetic field.,Both (a) and (b).,,d,,MCQ
8,Electromagnetism,Concept Application-Level-1,MCQ,35,The self or mutual induction takes place when magnetic flux through a coil ______.,remains steady,decreases,increases,Both (b) and (c).,,d,,MCQ
8,Electromagnetism,Concept Application-Level-1,MCQ,36,"Which of the following statements is incorrect? In the process of electromagnetic induction, the magnitude of the induced emf depends on ______.",the number of turns of the coil.,the magnetic flux linked with the coil.,the rate of change of magnetic flux linked with the coil.,area of the coil,,b,,MCQ
8,Electromagnetism,Concept Application-Level-1,MCQ,37,"Write the following steps in a sequential order to find the current and voltage in the secondary coil. The ratio of the number of turns of a primary to a secondary coil, current through the primary coil and input power are given.
a) Let the given data be taken as N~1*/N~2* (turn-ratio), i~1*, (input current) and P (input power).
b) Substitute the given values of N~1*/N~2* and i~1*, in the above formula and get the value of i~2*.
c) Write the relation between turn-ratio and the currents as N~1*/N~2*=i~2*/i~1*, where i~2* is the current in the secondary coil.
d) Write the relation between input power and output power in terms of V~1*, i~1*, V~2*, i~2*, i.e., V~1* i~1* = V~2* i~2* = P, where V~1* and V~2* are the voltage in the primary and secondary coils, respectively.
e) Substitute the values of i~2* and P in the above relation to get the value of V~2*",a d b c e,b c a d e,a c b d e,d b c a e,,c,,MCQ
8,Electromagnetism,Concept Application-Level-1,MCQ,38,"Write in the sequential order the following steps
of an experiment to show that a current carrying conductor sets up a magnetic field around it.
(a) Pass the insulated copper wire through the small hole at the centre of the cardboard and perpendicular to it.
(b) Paste a white paper on a rectangular cardboard and make a small hole at its centre.
(c) Connect this wire to a battery, a switch and a variable resistor in series.
(d) Clamp this cardboard to a stand in a horizontal position and sprinkle some iron filings over it.
(e) Now, when the circuit is closed, the iron filings on the cardboard form concentric circles around the wire.",b d a c e,b a c e d,a d b e c,e d a b c,,a,,MCQ
8,Electromagnetism,Concept Application-Level-1,MCQ,39,"Write the following steps of an experiment (in a sequential order), to establish that a circular current carrying wire creates a magnetic field around it.
(a) Sprinkle iron filings on the cardboard and switch on the circuit.
(b) Make two holes on a piece of cardboard covered with white paper. Pass this copper wire through the two holes of a cardboard .
(c) Take a copper wire and bend it in the form of a circle.
(d) Now connect the ends of the copper coil to a battery with a rheostat and a switch in series.
(e) You observe that the iron filings arrange themselves in concentric circles.",a c b d e,c b d a e, c a d b e,d c d a e,,b,,MCQ
8,Electromagnetism,Concept Application-Level-1,MCQ,40,"Two long parallel wires A and B separated by a distance d, carry currents i~1* and i~2* respectively in the same direction. Write the following steps in a sequential order to find the magnitude of the resultant magnetic field at a point ‘P’, which is between the wires and
is at a distance ‘x’ from the wire A. (All the physical quantities are measured in SI units)
(a) Note the given values of i~1*, i~2*, d and x .
(b) Write the formula to find the magnetic field due to a long straight current carrying wire, i.e. B = m~0*i/2πr
(c) Find the directions of the magnetic field at ‘P’ due to two wires A and B, using right hand thumb rule.
(d) Determine the magnetic field at P due to wire A, using 
B= μ~o*i/2πr.
(e) If the directions of magnetic field are same, then the resultant magnitude is equal to the sum of B1 and B2.
(f) Determine the magnetic field B2 due to wire B at point P, ie.
B~2* = μ~o*i~2*/2π(d-x).
(g) If the directions of magnetic fields are opposite to each other, then the resultant magnitude is equal to the difference of B~1* and B~2*.",d f c e g b a,c d f e g b a,a c b d f e g,a b d f c e g,,d,,MCQ
9,Modern Physics,Concept Application-Level-1,True - False,1,High energy neutrons are used in a nuclear reactor to initiate the fission reaction. ,,,,,,0,,TF
9,Modern Physics,Concept Application-Level-1,True - False,2,Cadmium rods are used as moderators in a nuclear reactor.,,,,,,0,,TF
9,Modern Physics,Concept Application-Level-1,True - False,3,Oxygen can be obtained from nitrogen by artificial nuclear transmutation.,,,,,,1,,TF
9,Modern Physics,Concept Application-Level-1,True - False,4,~0*n^1& + ~7*N^14& + ~1*H^0& + ~6*C^15&,,,,,,0,,TF
9,Modern Physics,Concept Application-Level-1,True - False,5,X–rays have higher penetrating power as they travel with very high velocity.,,,,,,0,,TF
9,Modern Physics,Concept Application-Level-1,True - False,6,"Higher the mass defect, higher will be the stability of the nucleus.",,,,,,0,,TF
9,Modern Physics,Concept Application-Level-1,True - False,7,The e/m ratio of Cathode rays is constant irrespective of the gas filled inside the discharge tube.,,,,,,0,,TF
9,Modern Physics,Concept Application-Level-1,Fill in the blanks,8,"If the binding energy per nucleon for ~3*Li^7& is 5.6 MeV, the total binding energy of a lithium nucleus is ____ MeV.",,,,,,39.2,,FIB
9,Modern Physics,Concept Application-Level-1,Fill in the blanks,9,The conversion of 1 u of mass results in _______eV of energy.,931.5 x 10^5&,931.5 x 10^6&,930.5 x 10^6&,931 x 10^6&,,B,,MCQ
9,Modern Physics,Concept Application-Level-1,Fill in the blanks,10,The common product formed in the artificial transmutation by a proton is _____.,,,,,,helium,,FIB
9,Modern Physics,Concept Application-Level-1,Fill in the blanks,11,"In plants and animals, the ratio of C^14& to C^12& is _______.",,,,,,a constant i.e 10^-12&,,FIB
9,Modern Physics,Concept Application-Level-1,Fill in the blanks,12,The radioactive radiation which can be stopped easily is a-rays.,,,,,,1,,TF
9,Modern Physics,Concept Application-Level-1,Fill in the blanks,13,"When an α-particle is ejected, the atomic number of the atom decreases by _______.",,,,,,2,,FIB
9,Modern Physics,Concept Application-Level-1,Fill in the blanks,14,The cathode rays emitted from a concave cathode meet at _____.,,,,,,centre of curvature,,FIB
9,Modern Physics,Concept Application-Level-1,Match the following,15,Match the entries in Column A with appropriate ones from column B.,"A:g, B:f, C:a, D:c, E:b, F:d, G:e, H:j, I:h, J:i","A:g, B:f, C:a, D:c, E:b, F:d, G:e, H:j, I:i, J:h","A:g, B:a, C:f, D:c, E:b, F:d, G:e, H:j, I:h, J:i","A:g, B:f, C:c, D:a, E:b, F:d, G:e, H:j, I:h, J:i",CH-9-15-ROW-345,A,,MCQ
9,Modern Physics,Concept Application-Level-1,MCQ,16,The specific charge is the highest for _____.,α-rays,β-rays,protons,neutrons,,b,,MCQ
9,Modern Physics,Concept Application-Level-1,MCQ,17,Which of the following is/are subatomic particles?,Protons,Positron,Neutrino,All of these,,d,,MCQ
9,Modern Physics,Concept Application-Level-1,MCQ,18,Which of the following radiations has the highest penetrating power?,α,β,γ,X-rays,,c,,MCQ
9,Modern Physics,Concept Application-Level-1,MCQ,19,The nuclear reaction that takes place in a nuclear reactor is _____.,controlled fission reaction,uncontrolled fission reaction,nuclear fusion reaction,None of these,,a,,MCQ
9,Modern Physics,Concept Application-Level-1,MCQ,20,Identify isobars among the following,"~14*Si^31&, ~15*P^32*","~6*C^13&, ~7*N^13*","~7*N^14&, ~7*N^15*",None of these,,b,,MCQ
9,Modern Physics,Concept Application-Level-1,MCQ,21,Higher value of decay constant indicates _____.,I) faster decay,II) high half-life period,III) slower decay,IV) Both (I) and (II),,a,,MCQ
9,Modern Physics,Concept Application-Level-1,MCQ,22,"To convert ~90*Th^232& into ~90*Th^228&, the least number of α and β particles that have to be emitted are _______ and _______, respectively.","1, 1","2, 1","1, 2","2, 2",,c,,MCQ
9,Modern Physics,Concept Application-Level-1,MCQ,23,The mass number of an element in a radioactive series is 223. Then the radioactive series is _____.,4 n,4n + 3,4n + 2,4n + 1,,b,,MCQ
9,Modern Physics,Concept Application-Level-1,MCQ,24,Carbon dating is used to,assess the age of fossils.,assess the amount of radioactivity.,assess the rate of radioactivity,None of these,,a,,MCQ
9,Modern Physics,Concept Application-Level-1,MCQ,25,The kinds of force(s) that are present between two protons in a nucleus is/are _____.,electrostatic force,nuclear force,magnetic force,Both (a) and (b),,d,,MCQ
9,Modern Physics,Concept Application-Level-1,MCQ,26,~Z*X^A& and ~Z+1*Y^A& are two radioactive elements. X emits one α particle whereas Y emits one β particle. The daughter nuclei formed are ________.,isotopes,isobars,isotones,isomorphic,,c,,MCQ
9,Modern Physics,Concept Application-Level-1,MCQ,27,"The e/m of three singly ionized atoms A, B and C are x, y, z, respectively. If x > y > z and m~A*, m~B*, and m~C* are their atomic weights, the correct relation among the following is _____.",m~A* > m~B* > m~C*,m~C* > m~B* > m~A*,m~A* = m~B* = m~C*,m~A* > m~B* = m~C*,,b,,MCQ
9,Modern Physics,Concept Application-Level-1,MCQ,28,A radioactive substance was reduced to 1/4 of the total amount in 8 days. The time taken by this radioactive substance to get reduced to 1/8 th of the remaining amount is ________.,12 days,16 days,20 days,8 days,,c,,MCQ
9,Modern Physics,Concept Application-Level-1,MCQ,29,~1*H^1& + ~3*Li^7& -> + ~2*Hl^4&,~2*Hl^4&,~6*C^12&,~4*Bl^9&,~4*Bl^8&,,a,,MCQ
9,Modern Physics,Concept Application-Level-1,MCQ,30,The property of cathode rays used in a monitor of a computer is _____.,high velocity,high ionization power,cause fluorescence of phosphors,rectilinear propagation,,c,,MCQ
9,Modern Physics,Concept Application-Level-1,MCQ,31,"If the radiations from a radioactive substance, in the presence of an electric field, deflect towards the anode, the rays are",α-rays,β-rays,γ-rays,X-ray,,b,,MCQ
9,Modern Physics,Concept Application-Level-1,MCQ,32,A radioactive isotope of radium placed in the second group in the periodic table emits one α-particle and one β-particle. The new element formed is in the ______ group,first,second,third,fourth,,a,,MCQ
9,Modern Physics,Concept Application-Level-1,MCQ,33,Which among the following statements is incorrect about visible light and X-rays?,They have same velocity in vacuum or air,They are electromagnetic radiations.,They have same wavelength in a given medium,They are not affected by electric field.,,b,,MCQ
9,Modern Physics,Concept Application-Level-1,MCQ,34,Cathod rays exert _______ force on the object place in their path.,mechanical,electrical,magnetic,electromagnetic,,b,,MCQ
9,Modern Physics,Concept Application-Level-1,MCQ,35,Which among the following has the lowest speed when travelling through a given medium?,γ-rays,α-rays,β-rays,Cathode rays,,b,,MCQ
9,Modern Physics,Concept Application-Level-1,MCQ,36,"Write the following steps in sequential order to calculate the binding energy per nucleon of an element ~z*X^A&, given the actual mass of ~z*X^A&, mass of proton (m~p*) and mass of neutron (m~n*) (All the values are given in atomic mass units)
(a) Note the actual mass of the nucleus (M), number of nucleons in ~z*A^x&, m~p* and m~n*.
(b) Calculate the mass defect of the given nucleus.
(c) Find the number of protons and number of neutrons in the nucleus.
(d) Determine the sum of the individual masses of constituents in ~z*A^X&.
(e) Calculate the binding energy (B.E) of the nucleus.
(f ) Divide it with the number of nucleons present in the element to get binding energy per nucleon.",a e d c b f,a c d b e f,a c b d e f,a d c b e f,,b,,MCQ
9,Modern Physics,Concept Application-Level-1,MCQ,37,The process of increasing the percentage of fissionable U-235 in naturally occurring uranium is called _______,controlled fission,artificial transmutation.,chemical process,enrichment.,,d,,MCQ
9,Modern Physics,Concept Application-Level-1,MCQ,38,_______ reaction takes place in the sun.,Nuclear fission,Nuclear fusion,Chemical,both (a) and (b),,b,,MCQ
9,Modern Physics,Concept Application-Level-1,MCQ,39,"Write the following steps of the liquid drop model in sequential order to show the various stages of a nuclear fission reaction.
(a) During the bombardment of a nucleus by neutrons, a neutron could be absorbed by the drop like the nucleus.
(b) A heavy nucleus is treated as the drop of a liquid with the positive charge uniformly distributed.
(c) This leads to the disturbance of the internal forces and sets up oscillations.
(d) From this stage the repulsive forces take over causing the fission of the nucleus.
(e) These oscillations lead to the development of a thick neck forming two parts, giving the nucleus an elongated shape.",b c e a d,a c e d b,a d c e b,b a c e d,,d,,MCQ
10,Source of Energy,Concept Application-Level-1,True - False,1,Tidal energy is a major source of energy due to the presence of large water bodies on the earth.,,,,,,0,,TF
10,Source of Energy,Concept Application-Level-1,True - False,2,The amount of heat energy released when a fuel burns completely is called calorific value.,,,,,,0,,TF
10,Source of Energy,Concept Application-Level-1,True - False,3,Sunlight contains ultraviolet radiations which make it hot.,,,,,,0,,TF
10,Source of Energy,Concept Application-Level-1,True - False,4,"Anaerobic microorganisms decompose animal and plant wastes in the presence of water and produce gases such as methane, CO~2*, H~2* and H~2*S. The mixture of these gases is called biomass.",,,,,,0,,TF
10,Source of Energy,Concept Application-Level-1,True - False,5,The calorific value of hydrogen is highest among fuels.,,,,,,1,,TF
10,Source of Energy,Concept Application-Level-1,True - False,6,The process of burning wood in limited supply of oxygen to obtain charcoal as a resultant product is called destructive distillation.,,,,,,1,,TF
10,Source of Energy,Concept Application-Level-1,True - False,7,Coal is the fossiled remains of dead bodies of marine animals that are buried in the earth’s crust for millions of years.,,,,,,0,,TF
10,Source of Energy,Concept Application-Level-1,Fill in the blanks,8,"A substance starts burning when it is exposed to air. Then, the ignition temperature of the substance is less than the _________.",,,,,,room temperature,,FIB
10,Source of Energy,Concept Application-Level-1,Fill in the blanks,9,The quality of coal depends on the percentage of _____ present in it.,,,,,,carbon,,FIB
10,Source of Energy,Concept Application-Level-1,Fill in the blanks,10,Burning of a substance in the insufficient amount of oxygen is called _______.,,,,,,destructive distillation,,FIB
10,Source of Energy,Concept Application-Level-1,Fill in the blanks,11,Petroleum is a complex mixture of many compounds of Hydrogen and Carbon known as ______.,,,,,,Hydrocarbons,,FIB
10,Source of Energy,Concept Application-Level-1,Fill in the blanks,12,Solar cooker is commonly used for harnessing ________.,,,,,,Solar energy,,FIB
10,Source of Energy,Concept Application-Level-1,Fill in the blanks,13,Energy harnessed from flowing water is called _____.,,,,,,Hydel energy,,FIB
10,Source of Energy,Concept Application-Level-1,Fill in the blanks,14,Energy sources which cannot be replenished are called non-renewable sources of energy,,,,,,1,,TF
10,Source of Energy,Concept Application-Level-1,Match the following,15,Match the entries in Column A with appropriate ones from Column B.,"A:b, B:a, C:d, D:f, E:c, F:g, G:e, H:h, I:i","A:b, B:a, C:d, D:f, E:c, F:g, G:e, H:I, I:h","A:a, B:b, C:d, D:f, E:c, F:g, G:e, H:I, I:h","A:b, B:d, C:a, D:f, E:c, F:g, G:e, H:I, I:h",CH-10-15-ROW-384,B,,MCQ
10,Source of Energy,Concept Application-Level-1,MCQ,16,Which of the following is a false statement?,"To overcome the energy crisis, the use of solar cooker must be increased.","To overcome the energy crisis, more amount of non-renewable sources of energy must be used.","The re-usage of waste material as a source of
energy can be done to overcome the energy crisis.","To overcome the energy crisis, water has to be saved.",,b,,MCQ
10,Source of Energy,Concept Application-Level-1,MCQ,17,"The main constituent of LPG is butane. Then 
(A) butane can be liquefied easily under high pressure.
(B) butane is liquefied by chemically reacting with ethane and propane.",Only A is true,Only B is true,Both A and B are true,Both A and B are false,,a,,MCQ
10,Source of Energy,Concept Application-Level-1,MCQ,18,Which element contained in a fuel contributes to its high calorific value?,Carbon,Hydrogen,Oxygen,Nitrogen,,b,,MCQ
10,Source of Energy,Concept Application-Level-1,MCQ,19,"Combustion, the process of burning a fuel, is _____.
(a) an oxidation and an exothermic reaction.
(b) a reduction and an endothermic reaction.",Only A is true,Only B is true,Both A and B are true,Both A and B are false,,a,,MCQ
10,Source of Energy,Concept Application-Level-1,MCQ,20,_____ is used as a fuel in space ships.,Hydrogen,Alcohol,Petrol,Diesel,,a,,MCQ
10,Source of Energy,Concept Application-Level-1,MCQ,21,"In solar water heater, a copper pipe with its outer surface painted in black is fixed in the form of a coil in a box.
(a) The only purpose of bending copper pipe is to increase the capacity of water storage.
(b) Bending copper pipe as a coil helps to increase the surface area for heating.
(c) Both",and,are true,Both,and (2) are false,,b,,MCQ
10,Source of Energy,Concept Application-Level-1,MCQ,22,"In the extraction of some metals from their ores, coke can be used as a/an ________.",oxidizing agent,reducing agent,catalyst,flux,,b,,MCQ
10,Source of Energy,Concept Application-Level-1,MCQ,23,Find the false statement from the statements given below:,Geothermal power plants cannot operate round the clock.,The initial cost in setting up this plant will be high.,This type of source is free and renewable.,Operating cost involved in a geothermal plant is less.,,a,,MCQ
10,Source of Energy,Concept Application-Level-1,MCQ,24,_____are used to produce energy in OTEC.,Tidal energy,Temperature difference between the different layers of water in ocean,Ocean waves,None of these,,b,,MCQ
10,Source of Energy,Concept Application-Level-1,MCQ,25,The crude oil extracted from the earth is separated into its constituents by a process called _____.,disintegration distillation,compound distillation,destructive distillation,fractional distillation,,d,,MCQ
10,Source of Energy,Concept Application-Level-1,MCQ,26,The sun’s energy is due to,the nuclear fission of hydrogen.,the nuclear fusion of hydrogen,the natural combustion of hydrogen,the nuclear fission of uranium.,,b,,MCQ
10,Source of Energy,Concept Application-Level-1,MCQ,27,Among the following the sources of energy for which source sun is not a chief source of energy is _____.,Hydroelectric power plant.,Ocean thermal energy conversion (OTEC).,Tidal energy.,Biomass.,,c,,MCQ
10,Source of Energy,Concept Application-Level-1,MCQ,28,What is the value of solar constant if the energy received by 12 m^2& area in 2 minutes is 2016 kJ?,1.4 x 10^2& J s^-1& m^-2&,1400 J s^-1& m^-2&,84 kJ s^-1& m^-2&,84 J s^-1& m^-2&,,b,,MCQ
10,Source of Energy,Concept Application-Level-1,MCQ,29,A good fuel should _____.,be safe to store and transport,be able to provide desired quantity of energy at a steady rate over a long period of time,have low content of non-combustibles and no combustion products that are poisonous or environmental pollutants,All of these,,d,,MCQ
10,Source of Energy,Concept Application-Level-1,MCQ,30,Find the false statement from the statements given below:,Geothermal power plants cannot operate round the clock.,The initial cost in setting up this plant will be high.,This type of source is free and renewable,Operating cost involved in a geothermal plant is less.,,a,,MCQ
10,Source of Energy,Concept Application-Level-1,MCQ,31,Which of the following metals is used as connecting wires that connect solar cells in a solar panel?,Copper,Iron,Aluminium,Silver,,d,,MCQ
10,Source of Energy,Concept Application-Level-1,MCQ,32,Quality that is not suitable for a fuel is ______.,high calorifgic value with ignition temperature that is well above the normal room temperature,low rate of evaporation at room temperature,carbon particles are expelled with smoke,low content of non-combustibles,,c,,MCQ
10,Source of Energy,Concept Application-Level-1,MCQ,33,Solar energy provides,wind energy,light energy,heat energy,All of these,,d,,MCQ
