Chapter Number,ChapterName,SubChapterName,Classification,QuestionNumber,QuestionText,Option1,Option2,Option3,Option4,Image?,Answer,AnswerDescription,QuestionType
6,Simple Machines ,Assessment Test - I,,2,"In a simple machine, the displacement of the load and velocity ratio are 5 cm and 6, respectively. What is the displacement of the effort (in cm)?",30,3 x 10^11&,3 x 10^-13&,3 x 10^-14&,,a,,MCQ
6,Simple Machines ,Assessment Test - I,,3,"If the angle of inclination of inclined plane is 45^0&, its mechanical advantage is _________.",2,Ö5,Ö2,Ö3,,c,,MCQ
6,Simple Machines ,Assessment Test - I,,4,"If the number of teeth in the driven gear of a vehicle is less than that of driving gear, the vehicle _________.",loses speed,gains speed,gains momentum,Both (b) and (c),,d,,MCQ
6,Simple Machines ,Assessment Test - I,,5,"If any lever acts as III order lever, then it is called _________ multiplier.",Force,Speed,Work,Pressure,,b,,MCQ
6,Simple Machines ,Assessment Test - I,,6,The work done in sliding an iron block of mass 10 kg along an inclined plane of inclination 30^0& and length 15 m is _________ J. [Take g = 10 m s^–2&],7.5 x 10^9&,75,7.5 x 10^2&,7.5 x 10^-2&,,c,,MCQ
6,Simple Machines ,Assessment Test - I,,7,"When the handle of a screw jack is rotated 8 times, the load is raised by 8 cm. If the length of the handle is 0.5 m, the MA is _________.",50π,10π,1000π,100π,,d,,MCQ
6,Simple Machines ,Assessment Test - I,,8,"The radii of the wheel and the axle are increased to 5 times and 3 times, respectively. The new M.A of the wheel and axel is _________ times the initial M.A.",5/3,3/2,9/4,25/9,,a,,MCQ
6,Simple Machines ,Assessment Test - I,,9,"The maximum force that can be borne by the nut placed in a nut-cracker is 300 N. The length of the cracker is 15 cm and the nut is placed at a distance of 5 cm from the fulcrum. If a person can apply a maximum of 50 N of force, find the % increase in the length of the cracker so that the person can crack the nut.",Zero,300,200,100,,d,,MCQ
6,Simple Machines ,Assessment Test - I,,10,What is the unit of torque?,Nm,Dyne cm,Watt,Both (a) and (b),,d,,MCQ
6,Simple Machines ,Assessment Test - I,,11,Match the statements of Column A with those of Column B.,a,b,c,d,CH-6-11-ROW-192,b,,MCQ
6,Simple Machines ,Assessment Test - I,,12,"In a Roman steelyard, as shown in the figure, a load of 200 gf is attached at 4 cm from the point of suspension HG = 2 cm, OH = 3 cm and the rider of weight 40 gf is at 25 cm mark. If the maximum mark on the scale is 50 cm, then the weight of the beam and the maximum load that can be attached to the beam are _________ and _________, respectively.","160 gf, 500 gf","160 gf, 450 gf","60 gf, 500 gf","450 gf, 60 gf",CH-6-12-ROW-193,b,,MCQ
6,Simple Machines ,Assessment Test - I,,13,"A man uses a smooth inclined plane of length 5 m to raise a load of 1000 N. If he does 2500 J of work and the inclined plane offers no resistance, then the mechanical advantage is __________.",1,2,3,4,,b,,MCQ
6,Simple Machines ,Assessment Test - I,,14,"An object is lifted by using a combination of two inclined planes as shown in the figure. If the effort required to move along the inclined plane of inclination 30^0& is 200 N, then the effort required to move along the inclined plane of inclination 45^0& is _________.",550 Ö2 N,650 Ö2 N,400 Ö2 N,350 Ö2 N,CH-6-14-ROW-195,c,,MCQ
6,Simple Machines ,Assessment Test - I,,15,"A pair of fire tongs has its arms 20 cm long. It is used to lift a coal of weight 15 N by applying an effort of 20 N. Arrange the following steps to determine the distance at which effort applied from the end and M.A in proper sequence:
A) Use the relation between load, effort, load arm and effort arm and MA.
B) Note the data given.
C) Determine the load arm from the given data.
D) Determine the value of M.A and effort arm.",ACBD,DCBA,BDCA,BCAD,,d,,MCQ
6,Simple Machines ,Assessment Test - II,,1,Our hand is a III order lever because _________ lies between fulcrum and __________.,"Load, Effort","Effort, Load","Elbow, Fulcrum","Hand, Effort",,b,,MCQ
6,Simple Machines ,Assessment Test - II,,2,"In a simple machine, the displacement of the effort and displacement of load are 8 cm and 24 cm, respectively. What will be the velocity ratio?",1/3,3,192,0.33,,a,,MCQ
6,Simple Machines ,Assessment Test - II,,3,"What is its angle of inclination, if the mechanical advantage of an inclined plane is 2Ö3?",150^0&,45^0&,30^0&,60^0&,,d,,MCQ
6,Simple Machines ,Assessment Test - II,,4,"If the number of teeth in the first gear in a vehicle is n~1* and the number of teeth in the second gear is n~2*, then _________.",n~1* > n~2*,n~1* < n~2*,n~1* = n~2*,n~1* = n~1*^1&,,a,,MCQ
6,Simple Machines ,Assessment Test - II,,5,"The lever in which the effort arm is longer than the load arm is called
__________ multiplier.",Force,Speed,Energy,Pressure,,a,,MCQ
6,Simple Machines ,Assessment Test - II,,6,The work done in sliding a wooden box of mass 15 kg along an inclined plane of inclination 45^0& is 50 J. What is the length of the inclined plane? [Take g = 10 m s^–2&],7.5 Ö2 cm,Ö2/3 m,10.6 cm,1/2 m,,b,,MCQ
6,Simple Machines ,Assessment Test - II,,7,"When the handle of a screw jack is rotated 8 times, the load is raised by 10 cm. If the MA is 80 π, then the length of the handle is _________.",0.5 m,8 m,0.6 m,0.4 m,,a,,MCQ
6,Simple Machines ,Assessment Test - II,,8,"The radii of the wheel and axle are 20 cm and 5 cm, respectively. When the radius of the wheel is increased by x% without changing the radius of the axle, the new M.A is 6. What is the value of x?",25,50,75,100,,b,,MCQ
6,Simple Machines ,Assessment Test - II,,9,The physical quantity which has unit is _________.,Velocity ratio,M.A.,Load,Both (a) and (b),,c,,MCQ
6,Simple Machines ,Assessment Test - II,,10,"The maximum force that can be borne by the nut placed in a cracker is
400 N. The length of the cracker is 40 cm and the nut is placed at a distance of 10 cm from the free end of the cracker. If a boy can apply a maximum force of 50 N, then the length of the extension rod that should be attached to the cracker hand so that the boy can crack the nut is _________.",40 cm,60 cm,80 cm,Zero,,a,,MCQ
6,Simple Machines ,Assessment Test - II,,11,Match the statements of Column A with those of Column B.,a,b,c,d,CH-6-11-ROW-207,a,,MCQ
6,Simple Machines ,Assessment Test - II,,12,"In a Roman steel yard shown in the figure, a load of 250 gf is attached at A, 4 cm from the point of suspension HG = 2 cm, OH = 3 cm and rider is at 25 cm mark. If the weight of the beam is 60 gf, then the weight of the rider is __________ gf.",40,"4,000",400,4,CH-6-12-ROW-208,a,,MCQ
6,Simple Machines ,Assessment Test - II,,13,"A man uses a smooth inclined plane of length 6 m to raise a load of 2000 N. If he does 3,000 J of work, the height of the inclined plane is _________ m.",2,3,1.5,1.6,,c,,MCQ
6,Simple Machines ,Assessment Test - II,,14,"An object of 200 kg is lifted by using two inclined planes joined together as shown in the figure. If the effort required to move along the inclined plane of angle of inclinination 45^0& is 2/3 of that on CD, determine the mechanical advantage on the plane CD.",2Ö2,3Ö2,2Ö2/3,3,CH-6-14-ROW-210,c,,MCQ
6,Simple Machines ,Assessment Test - II,,15,"A pair of fire tongs is used to lift a coal of weight 3 kg f by applying an effort of 9 kg at a distance of 15 cm from the fulcrum.
Arrange the following steps in proper order to find the load arm.
A) Use the relation between load, effort, effort arm and load arm.
B) Note the given data.
C) Determine the effort arm from the given information.
D) Determine the load arm.",BADC,BDCA,BCDA,BCAD,,d,,MCQ
7,Gravitation,Assessment Test - I,,1,According to Kepler’s law of planetary motion _________.,planets trace equal distance in equal intervals of time,planets move around sun with constant speed,planets revolve around the sun in elliptical orbit,Both (a) and (c),,c,,MCQ
7,Gravitation,Assessment Test - I,,2,"All the particles of a shuttlecock execute complicated motion, but its
_________ describes the simplest path when it is projected.",centre of mass,base,geometric centre,geometric top,,a,,MCQ
7,Gravitation,Assessment Test - I,,3,The period of revolution of a geostationary satellite is _________ that of the period of rotation of the Earth.,Equal to,Greater than,Less than,Both (a) and (c),,a,,MCQ
7,Gravitation,Assessment Test - I,,4,Which one among the followings is not correct about escape velocity?,It depends on mass of the planet.,It depends on the value of acceleration due to gravity of the planet.,Escape velocity is greater than orbital velocity for a given planet.,None of these.,,d,,MCQ
7,Gravitation,Assessment Test - I,,5,"When distance between two bodies of masses m~1* and m~2* is doubled, then gravitational force between them is _________ of initial gravitational force.",1^th&/4,1^th&/5,4 times ,twice,,a,,MCQ
7,Gravitation,Assessment Test - I,,6,"The ratio of the masses of two planets is 1:10 and the ratio of their diameters is 1:5. If the length of a seconds pendulum on the first planet is 0.5 m, then the length of the seconds pendulum on the second planet is ___________.",0.2 m,0.3 m,0.4 m,0.5 m,,a,,MCQ
7,Gravitation,Assessment Test - I,,7,Two satellites of identical masses orbit the Earth at different heights. The ratio of their distance from the centre of the Earth is d : 1 and the ratio of the g value is x : 1. What is the ratio of their orbital velocities?,Öxd,dÖx,xÖd,Ö(x/d),,a,,MCQ
7,Gravitation,Assessment Test - I,,8,"A cylinder is resting on its lateral surface. If the height of the cylinder h is twice the diameter of a sphere, then the difference between their heights of C.G is __________.",h/2,3h / 4,h/4,Information is not sufficient,,d,,MCQ
7,Gravitation,Assessment Test - I,,9,What is the ratio of escape velocity of the Earth to orbital velocity on the Earth?,Ö2,2,Ö3,3,,a,,MCQ
7,Gravitation,Assessment Test - I,,10,A simple pendulum of length 0.5 m and time period 5 s oscillating at a height h from the surface of the Earth. Write the following steps to determine the value of h in sequential order.,ABCD,ACBD,ADBC,BACD,CH-7-10-ROW-221,a,,MCQ
7,Gravitation,Assessment Test - I,,11,Match the statements of Column A with those of Column B.,A,B,C,D,CH-7-11-ROW-222,c,,MCQ
7,Gravitation,Assessment Test - I,,12,"When a spring balance which shows a reading of 9 divisions on the Earth is taken to another planet of mass of twice of that of the Earth and radius thrice of that of the Earth, then it shows the reading of _________ division for the same body.",1,3,5,2,,d,,MCQ
7,Gravitation,Assessment Test - I,,13,A cylindrical tank of height 1 m has capacity of 2000 liters. An electric motor pump set lifts 200 liters of water per minute. What is the velocity of shift of C.G of the tank?,0.93 m s^-1&,0 m s^-1&,0.083 m s^-1&,0.83 m s^-1&,,c,,MCQ
7,Gravitation,Assessment Test - I,,14,The quantity which is constant for a planet is _________.,Speed,Velocity,Kinetic energy,None of these,,d,,MCQ
7,Gravitation,Assessment Test - I,,15,What is the kinetic energy needed to project a body of mass m from the Earth’s surface to infinity?,1/4 mg R,1/2 mg R,mg R,3 mg R,,c,,MCQ
7,Gravitation,Assessment Test - II,,1,"According to Kepler’s III law of planetary motion, __________ . (T = time period, R = Radius of the orbit)",T a R,T~2& a R~3&,T~3& a R~2&,T a R~3&,,b,,MCQ
7,Gravitation,Assessment Test - II,,2,"What is the point inside the body, at which the whole mass of the body is assumed to be concentrated?",Centre of mass,Centre of gravity,geometric centre,None of these,,a,,MCQ
7,Gravitation,Assessment Test - II,,3,Geo stationary satellite is __________.,a polar satellitet,a non-polar satellite,a satellite of time period equal to time period of rotation of the Earth.,Both (b) and (c),,d,,MCQ
7,Gravitation,Assessment Test - II,,4,Which of following statements is false?,"For a given planet, the orbital velocity is less than the escape velocity.",Oribital velocity of the Earth is 7.78 km s^–1& .,There is no atmosphere on the Moon because its escape velocity is very high.,Both (a) and (b),,c,,MCQ
7,Gravitation,Assessment Test - II,,5,"Two bodies are separated by a distance of 50 m and their masses are 500 kg and 1000 kg. If the distance between them is doubled and their masses are halved, then the new gravitational force is ___________.",1.5 G,12.5 G,50 G,5000 G,,b,,MCQ
7,Gravitation,Assessment Test - II,,6,"The ratio of the masses of two planets A and B is 2 : 5 and the ratio of their diameters is 5 : 8, respectively. If the time period of a simple pendulum on planet A 5s, then time period of the same simple pendulum on planet B is ___________ seconds.",a,b,c,d,CH-7-6-ROW-232,d,,MCQ
7,Gravitation,Assessment Test - II,,7,"Two satellites of identical masses orbit around two planets separately. The ratio of their distances from the centres of their planets is 2 : 1 and the ratio of the g values on the surfaces of planets is gp:1. If the ratio of their escape velocities is 2 : 3, then g~p* = __________.",4/9,3/9,2/9,5/9,,c,,MCQ
7,Gravitation,Assessment Test - II,,8,"A cylinder resting on its curved surface and a sphere are considered. If their radii are the same and the height of cylinder is 2 m, s then the difference in their heights of their centres of gravity C.G is __________ m.",0,1,2,Information not sufficient,,a,,MCQ
7,Gravitation,Assessment Test - II,,9,"The ratio of escape velocity on the surface of the Moon to orbital velocity on the Earth is ___________. (Take R~e* = 64 × 10^5& m , R~m* = 1.74 × 10^6& m)",0.1,0.2,0.3,0.4,,c,,MCQ
7,Gravitation,Assessment Test - II,,10,"A simple pendulum is oscillating at a height of 100 km from the surface of the Earth. If the length of the pendulum is 100 cm, write the following steps in sequential order to determine the value of time period.",ABDC,ABCD,CBAD,CDAB,CH-7-10-ROW-236,b,,MCQ
7,Gravitation,Assessment Test - II,,11,Match the statements of Column A with those of Column B.,A,B,C,D,CH-7-11-ROW-237,d,,MCQ
7,Gravitation,Assessment Test - II,,12,The difference in the readings shown by a spring balance for a body of mass 40 kg on the surface of the Earth and a planet of mass half of that of the Earth and radius twice that of the Earth is __________ N (Take g = 10 m s^–2&),320,3200,350 N,500 N,,c,,MCQ
7,Gravitation,Assessment Test - II,,13,"A cylindrical tank of capacity 1000 litre has its height 1 m. An electric motor pump set lifts x litre of water per minute. If the velocity of shift of C.G is 10^–3& m s^–1&, then the value of x is __________.",1200 l,120 l,130 l,12000 l,,b,,MCQ
7,Gravitation,Assessment Test - II,,14,"In a planetary motion, a planet ___________ in equal intervals of time.",traces equal areas,travels with a uniform speed distance,Both (a) and (b),travels with a uniform velocity,,a,,MCQ
7,Gravitation,Assessment Test - II,,15,"The momentum needed to project a body of mass 5 kg from the surface of the Moon to infinity is ___________ kg m s^–1& . (Take, mass of the Moon = 7.3 × 10^22& kg) (radius of the Moon = 1.74 × 10^6& m)",14.45 x 10^8& ÖG,14.45 x 10^6& ÖG,14.45 x 10^3& ÖG,14.45 x 10^-6& ÖG,,a,,MCQ
8,Hydrostatics,Assessment Test - I,,1,"A cylindrical body floats in water such that half of its volume lies above the surface water. What is the relative density of the material, with which the body is made of?",0.5,0.75,1,1.5,,a,,MCQ
8,Hydrostatics,Assessment Test - I,,2,"The areas of cross section of two cylinders of a Bramah press are 20 cm^2& and 100 cm^2&, respectively. In order to move up a weight of 200 N placed on the piston of the larger area of cross section, what should be the force that applied on the piston of smaller area?",10 N,20 N,30 N,40 N,,d,,MCQ
8,Hydrostatics,Assessment Test - I,,3,"A body weighs 65 g wt in air, 57 g wt when completely immersed in water and 41 g wt when complety immersed in a liquid. Determine the density of the liquid.",3 g cm^-3&,6 g cm^-3&,10 g cm^-3&,9 g cm^-3&,,a,,MCQ
8,Hydrostatics,Assessment Test - I,,4,"A wooden block, with a body placed on its top, floats in water as shown in the figure given below. After some time, the coin falls into water. If 'l’ represents the length of the immersed part of the body and ‘h’ represents the height of the liquid column, then which of the following options is true?",l decreases and h increases.,l increases and h decreases.,Both l and h increases.,Both l and h decreases.,,d,,MCQ
8,Hydrostatics,Assessment Test - I,,5,"A U-shaped tube of uniform cross section is filled with liquid A. Another liquid B which does not mix with liquid A is poured into one of the limbs. It is observed that the liquid levels in the two sides of the tube are the same while the level of liquid A has risen by 2 cm from its initial position. If the specific gravity of liquid A is 1.1, then what will be the specific gravity of liquid B?",1.12,1.05,1.1,1,CH-8-5-ROW-246,c,,MCQ
8,Hydrostatics,Assessment Test - I,,6,"Two solids X and Y float in water. It is observed that X floats with half of its volume immersed and Y floats with two-third of its volume immersed.
What will be the ratio of densities of X and Y?",2 : 3,3 : 4,4 : 3,3 : 2,,b,,MCQ
8,Hydrostatics,Assessment Test - I,,7,A cubical box of wood of side 30 cm weighing 21.6 kg floats on water with its lateral faces vertical. What will be the depth of immersion of the box?,30 cm,28 cm,24 cm,12 cm,,c,,MCQ
8,Hydrostatics,Assessment Test - I,,8,A ball of mass ‘m’ and density ρ is immersed in a liquid of density 2ρ is held at a depth ‘h’ by an external force and released. To what height will the ball jumps up above the surface of liquid? (neglect the resistance of water and air).,3 h,2 h,h ,h/2,,c,,MCQ
8,Hydrostatics,Assessment Test - I,,9,Two liquids which do not react chemically are poured into a U-shaped tube as shown in the figure given below. What will be the heights of the liquids above their surface of separation?,equal,directly proportional to their densities.,inversely proportional to their densities.,inversely proportional to the square of their densities.,CH-8-9-ROW-250,c,,MCQ
8,Hydrostatics,Assessment Test - I,,10,"A tube is inverted in a mercury vessel as shown in the figure given below. If pressure ‘P’ is increased, then which of the following options is true?",Height ‘h’ will decrease.,pressure at O will remain the same.,pressure at O increases,both (a) and (b).,CH-8-10-ROW-251,d,,MCQ
8,Hydrostatics,Assessment Test - I,,11,"Arrange the following steps in sequential order to explain the working of a hydraulic press.
A) The pressure transmitted to the water in the press tube exerts thrust on the press piston in the upward direction.
B) Now when the piston of the pump tube is pressed, the pressure is
exerted on the water in the pump tube. The pressure is transmitted to
the water in the press tube.
C) The lever attached to the pump piston is lifted up to draw water into the pump tube.
D) Due to the thrust on the press piston, the platform connected to the press piston moves in the upward direction.
E) When the platform moves in the upward direction, the material placed on the platform is pressed against the concrete ceiling.",CBADE,CABED,CDEAB,CEABD,,a,,MCQ
8,Hydrostatics,Assessment Test - I,,12,"Arrange the following steps in sequential order to calculate the atmospheric pressure in the SI system at a height of 1050 m. Take the normal atmospheric pressure on the surface of the Earth as 76 cm of Hg.
(A) By assuming that the density of atmosphere is uniform, on rising a
height of 105 m from the surface of the Earth, the atmospheric pressure falls by 1 cm of Hg.
(B) Find the height of the mercury column at the given height by subtracting the fall in the pressure from the normal atmospheric pressure.
(C) Convert the height of the mercury column into meters and calculate the atmosphere pressure at the given height in SI system, using the formula hdg.
(D) Find the fall in atmospheric pressure in terms of the height of the Hg column at the height 1050 m by dividing with 105 m.",CBAD,ADBC,ABDC,ABCD,,b,,MCQ
8,Hydrostatics,Assessment Test - I,,13,Match the statements of Column A with those of Column B.,A,B,C,D,CH-8-13-ROW-254,d,,MCQ
8,Hydrostatics,Assessment Test - I,,14,"Assertion (A) : A piece of ice floats on water.
Reason (R) : Density of ice is less than the density of water.",A and R are true and R is the correct explanation of A.,"A and R are true, but R is not the correct explanation of A.",A is true but R is false,Both A and R are false,,a,,MCQ
8,Hydrostatics,Assessment Test - I,,15,"Assertion (A) : The vertical height of the mercury column in a barometer decreases as the vertical height from the mean sea level increases.
Reason (R) : As the vertical height from the mean sea level increases, the atmospheric pressure decreases.",A and R are true and R is the correct explanation of A.,"A and R are true, but R is not the correct explanation of A.",A is true but R is false,Both A and R are false,,a,,MCQ
8,Hydrostatics,Assessment Test - II,,1,If a cylindrical wooden piece of density 750 kg m^–3& is floating in water. Determine the fraction of the length of the cylinder inside the water.,1/4,1/2,3/4,3/2,,c,,MCQ
8,Hydrostatics,Assessment Test - II,,2,The mechanical advantage of a hydraulic press is 10. A car of mass 1000 kg is lifted by it when placed on a piston of a hydraulic press of area of cross section 10 cm^2.& What is the area of cross section of the piston where the effort applied?,1 cm^2&,2 cm^2&,3 cm^2&,4 cm^2&,,a,,MCQ
8,Hydrostatics,Assessment Test - II,,3,A body weighs 70 gf in air and 45 gf in water. Determine the weight of the body in a liquid whose density is twice that of water.,10 gf,20 gf,30 gf,40 gf,,b,,MCQ
8,Hydrostatics,Assessment Test - II,,4,"If the weight of the body and upthrust on the body in a liquid are equal, then the body",sinks,floats and partly immerses in the liquid.,floats and immerses in the liquid,completely lies outside the liquid,,c,,MCQ
8,Hydrostatics,Assessment Test - II,,5,"The liquids shown in the U-tube of uniform cross section are mercury and water. If the difference in the heights of the mercury column is 2 cm, then determine the height ‘h’of the water column",6.5 cm,54 cm,13.6 cm,27.2 cm,CH-8-5-ROW-261,d,,MCQ
8,Hydrostatics,Assessment Test - II,,6,"When a loaded pipe floats vertically with 1/3 and 1/4 of the lengths inside two liquids A and B, then calculate the ratio of the densities of the two liquids.",3 : 4,4 : 3,16 : 9,9 : 1,,a,,MCQ
8,Hydrostatics,Assessment Test - II,,7,"The mass of a wooden block of size 8 × 8 × 8 cm is 307.2 g. When it is floating in water, how much is the height of the wooden block above water level.",6 cm,4 cm,4.8 cm,3.2 cm,,d,,MCQ
8,Hydrostatics,Assessment Test - II,,8,A ball of relative density 0.8 falls into water from a height 2 m. Calculate the depth to which the ball will sink. (neglect viscous forces),8 m,2 m,6 m,4 m,,a,,MCQ
8,Hydrostatics,Assessment Test - II,,9,A ball of density ρ is released from deep inside a liquid of density 2ρ. It will move up,with increasing acceleration.,with decreasing acceleration,with constant acceleration,with zero acceleration,,c,,MCQ
8,Hydrostatics,Assessment Test - II,,10,A cube is floating in a liquid as shown in the figure given below,"If the density of the liquid decreases, x will increase","If size of the cube is increased without changing the mass, x will decrease",Both (a) and (b) are true,Both (a) and (b) are false.,CH-8-10-ROW-266,c,,MCQ
8,Hydrostatics,Assessment Test - II,,11,"Arrange the following steps in sequential order to explain how hydraulic brakes work in order to stop a vehicle.
A) The increase in pressure on the brake oil in the master cylinder is transmitted to the brake oil in the brake cylinder.
B) Due to the friction between brake shoes and the wheel rim, the vehicle stops.
C) The pistons of the brake cylinder are pushed outwards, then the pistons press the brake shoes against the rim of the wheel.
D) When a driver applies force on the brake pedal, the force is transmitted to the master cylinder and it applies pressure on the brake oil in the master cylinder.",DACB,DBAC,CADB,ADCB,,a,,MCQ
8,Hydrostatics,Assessment Test - II,,12,"Arrange the following steps in sequential order to calculate the height of the liquid column to balance the atmospheric pressure. When the barometric tube is filled with a liquid of density 4.3 g cm^–3&. Take the atmospheric pressure as 76 cm of Hg.
(A) Calculate the pressure exerted by the liquid column, using the formula hdg, [height = h, density (d) = 4.3 g cm^–3&, g = 1000 cm s^–2&]
(B) Determine the atmospheric pressure, using the formula hdg, by taking the height ‘h’ as 75 cm, density ‘d’ of mercury as 13.6 g cm^–3& and ‘g’ as 1000 cm s^–2&.
(C) Let ‘h’ be the height of the liquid column balanced by the atmospheric pressure.
(D) Find the value of h, by equating the atmospheric pressure and the pressure exerted by the liquid column.",BDAC,BADC,ADCB,CABD,,d,,MCQ
8,Hydrostatics,Assessment Test - II,,13,Match the statements of Column A with those of Column B.,A,B,C,D,CH-8-13-ROW-269,c,,MCQ
8,Hydrostatics,Assessment Test - II,,14,"Assertion (A) : For a floating body to be in stable equilibrium, its centre of buoyancy must be located above the centre of gravity.
Reason (R) : Upthrust exerted by the liquid will restore the body back to its normal position, after the body is disturbed.",A and R are true and R is the correct explanation of A.,"A and R are true, but R is not the correct explanation of A.",A is true but R is false,Both A and R are false,,a,,MCQ
