Chapter Number,ChapterName,SubChapterName,Classification,QuestionNumber,QuestionText,Option1,Option2,Option3,Option4,Image?,Answer,AnswerDescription,QuestionType
4,Dynamics,Assessment Test - I,,4,"A body of mass 15 kg rests on a floor of coefficient of friction 0.2. The velocity of the body has to be increased by 5 m s^–1& when it is displaced through a distance of 300 cm. Write the steps in sequential order to find the minimum force required.
(A) Calculate the net acceleration produced in the body, using the expression, v^2&– u^2& = 2as.
(B) The sum of the net force and frictional force gives the minimum force required to make the body move.
(C) Note the values of v, u, s, μ and m and convert all the units into the same system.
(D) Substitute the value of 'a' in the expression, F~net* = ma, to calculate the net force required to change its velocity.
(E) Calculate the net acceleration produced in the body, using the formula, Ff = μmg.",CDAEB,CEABD,CADEB,CBAED,,c,,MCQ
4,Dynamics,Assessment Test - I,,5,A bullet of mass 0.02 kg is stopped by a wooden block at rest. The work done by the block on the bullet is 2500 J. What is the velocity of the bullet when it hit the wooden block?,50 m s^-1&,500 m s^-1&,500 cm s^-1&,500 mm s^-1&,,b,,MCQ
4,Dynamics,Assessment Test - I,,6,"A bullet of mass 0.25 kg released from a gun with an initial velocity of
40 m s^–1& after hitting a wall it comes to rest in 20 s. What is the retarding force acting on it?",10 N,2 N,0.5 N,5 N,,c,,MCQ
4,Dynamics,Assessment Test - I,,7,"The energy stored in a stretched spring is 36 J and spring constant 800 N m^–1&, then the elongation in the spring is _________.",300 m,300 cm,3 cm,30 cm,,d,,MCQ
4,Dynamics,Assessment Test - I,,8,"A machine gun can fire 150 bullets per minute. If the mass of the bullet is 20 g and its velocity is 50 m s^–1&, then the rate of work done by the gun is _________.",15/7 W,70 W,62.5 W,50/3 W,,c,,MCQ
4,Dynamics,Assessment Test - I,,9,Match the entries given in Column A with the appropriate ones in Column B with the help of the figure. The coefficient of friction between both the surfaces of the block and the ground is 0.1 (Take g = 10 m s^–2&).,a,b,c,d,CH-4-9-ROW-100,c,,MCQ
4,Dynamics,Assessment Test - I,,10,"A block of mass 4 kg is attached to a spring and performing horizontal uniform circular motion. The spring constant is 4 × 104 N m^–1& and extension observed in the spring is 4 cm, then the work done by the centrifugal force on the spring is _________.",1 J,16 J,0,64 x 10^4& J,,c,,MCQ
4,Dynamics,Assessment Test - I,,11,"A block is sliding along a frictionless inclined plane as shown in figure
[Take g = 10 ms^–2&] . Find the work done by normal contact force when the body reaches the bottom.",a,b,c,d,CH-4-11-ROW-102,d,,MCQ
4,Dynamics,Assessment Test - I,,12,"If the horse power of an engine A is double that of another engine B. Then what is the ratio of time span of engines A and B, respectively, to do the same amount of work?",1 : 1,1 : 2,2 : 1,1 : 4,,b,,MCQ
4,Dynamics,Assessment Test - I,,13,A worker climbs up a staircase carrying a load of 40 kg on his head. The staircase has 20 steps and the height of each step is 10 cm. What is the work done by the worker to lift the load against the gravity when he reaches the 20^th& step?,200 J,80 J,784 J,74.8 J,,c,,MCQ
4,Dynamics,Assessment Test - I,,14,Match the statements of Column A with those of Column B.,A,B,C,D,CH-4-14-ROW-105,b,,MCQ
4,Dynamics,Assessment Test - I,,15,"The energy stored in a stretched spring is 8 J and the spring constant is 400 N m^–1&, then the elongation in the spring is _________.",200 m,0.2 m,2 cm,0.02 mm,,b,,MCQ
4,Dynamics,Assessment Test - II,,1,Identify a conserved physical quantities during collision from the following:,Momentum,Mass,Velocity,Both (a) and (b),,d,,MCQ
4,Dynamics,Assessment Test - II,,2,Which of the following has the least value of coefficient of friction?,Rolling friction,Limiting friction,Static friction,Sliding friction,,a,,MCQ
4,Dynamics,Assessment Test - II,,3,What is the work done by a motor to lift 500 kg of a block to 10 m height?,9800 J,49000 j,4900 j,98000 j,,b,,MCQ
4,Dynamics,Assessment Test - II,,4,Match the statements of Column A with those of Column B.,a,b,c,d,CH-4-4-ROW-110,c,,MCQ
4,Dynamics,Assessment Test - II,,5,"A ball of mass 0.5 kg moving with a velocity of 20 m s^–1& hits a wall normally and rebounds with a velocity of half of its initial velocity. Then, write the step in sequential order to determine the impulsive force.
(A) Find out the momentum of the ball before hitting the wall.
(B) Find out the momentum of the ball after bouncing back from the wall.
(C) Note down the given values of mass, initial velocity and final velocity.
(D) Determine the difference between the momentum of the ball which is impulsive force acting on it.",CABD,ACBD,CBDA,BCAD,,a,,MCQ
4,Dynamics,Assessment Test - II,,6,"Time period of a simple pendulum, T = 2πÖl/g, if the ratios of two different pendulums length and accelaration due to gravity are 16 : 9 and 64 : 81, respectively. What is the value of T~1*/T~2*?",3 : 2,2 : 3,1 : 1,1 : 1,,a,,MCQ
4,Dynamics,Assessment Test - II,,7,"A ball of mass 0.5 kg moving with a velocity 5 m s^–1& hits a wall normally and rebounds with half of the initial velocity. If the ball is in contact with the wall for 0.5 s, the force exerted by the wall on it is _________.",3.75 mN,3.75 x 10^-2& N,7.5 N,0.375 N,,c,,MCQ
4,Dynamics,Assessment Test - II,,8,"When a spring is stretched by 7 cm, the maximum force acting between any two points in the spring is _________ (Take spring constant, K = 500 N m^–1&).",35 N,45 N,50 N,60 N,,a,,MCQ
4,Dynamics,Assessment Test - II,,9,"When the time periods of two pendulums are in the ratio 1 : 5, the ratio of their effective lengths is _________.",25 : 1,5 : 1,1 : 5,1 : 25,,d,,MCQ
4,Dynamics,Assessment Test - II,,10,"If velocity and mass of a bullet are 20 m s^–1& and 10 g, respectively, then the momentum of the gun after firing a bullet is _________.",200 kg m s^-1&,250 kg m s^-1&,0.2 kg m s^-1&,350 kg m s^-1&,,c,,MCQ
4,Dynamics,Assessment Test - II,,11,Match the statements of Column A with those of Column B with the help of the figure. (Take g = 10 m s^–2&; Ö3 = 1.7),a,b,c,d,CH-4-11-ROW-117,b,,MCQ
4,Dynamics,Assessment Test - II,,12,"A block of 2 kg mass is attached to a spring and it performs horizontal uniformcircular motion with speed 10 m s^–1& in the radius 2 m. If the  spring constant is 2 × 10^4 Nm^–1&, then the extension in the spring will be _________.",Half centimetre,0.5 m,10^4&,2 x 10^-3& cm,,a,,MCQ
4,Dynamics,Assessment Test - II,,13,"A ball is released along a frictionless curved surface of radius 2 m from the point A. If the mass of the ball is 0.2 kg, then the work done by the gravity when it reaches the point B is _________.",a,b,c,d,CH-4-13-ROW-119,c,,MCQ
4,Dynamics,Assessment Test - II,,14,"If the horse power of an engine B is four times that of the horse power of an engine A, then the ratio of the the work done by A and B in the time span of 10 min and 20 min, respectively is _________.",1 : 2,1 : 4,8 : 1,1 : 8,,d,,MCQ
4,Dynamics,Assessment Test - II,,15,A worker climbs up a stair-case carrying a load of 20 kg on his head. The staircase has 10 steps and each step is 0.1 m height. Then the amount of work done by the gravity when he climbs one step is _________.,-20 J,-4 J,40 J,8 J,,a,,MCQ
4,Dynamics,Assessment Test - III,,1,"A spring is compressed by 2 cm. For this, the amount of work done is 0.8 J. The force constant of the spring is _________ N m^–1&.",1000,4000,800,1600,,b,,MCQ
4,Dynamics,Assessment Test - III,,2,"If kinetic energy is decreased by 36%, find the percentage decrease in
momentum.",40%,98%,20%,23%,,c,,MCQ
4,Dynamics,Assessment Test - III,,3,A bullet is fired into a file of identical planks with a speed of u and it gets stopped after penetrating through 8 similar planks. What will be the velocity of the bullet after passing through the first plank?,A,B,C,D,CH-4-3-ROW-124,b,,MCQ
4,Dynamics,Assessment Test - III,,4,A bomb of mass m explodes into two fragments 2m/3 and m/3 which move in opposite directions. What is the ratio of momenta?,1 : 2,2 : 1,4 : 1,1 : 1,,d,,MCQ
4,Dynamics,Assessment Test - III,,5,"Bullets are fired from a gun at the rate of 30 per minute. If 12 N of force is required to keep the gun in position, find the speed of each bullet. Mass of the each bullet is 30 g.",300 m s^-1&,400 m s^-1&,800 m s^-1&,600 m s^-1&,,c,,MCQ
4,Dynamics,Assessment Test - III,,6,Why does a body rolling on the surface of the Earth come to the state of rest after some time?,it has mass,it experiences friction,it has intertia of rest,All of the above,,b,,MCQ
4,Dynamics,Assessment Test - III,,7,Two blocks of masses 3 kg and 4 kg are placed on the frictionless surface as in the figure. A force of 10 N is applied on the 3 kg block. Find the force of contact between the blocks.,30/7 N,40/7 N,12/7 N,5 N,CH-4-7-ROW-128,b,,MCQ
4,Dynamics,Assessment Test - III,,8,"When a horse pulls a cart, the force which helps the horse to move forward is the force exerted by _________.",the cart on the horse,the ground on the horse,the ground on the cart,the horse on the ground,,b,,MCQ
4,Dynamics,Assessment Test - III,,9,"A bullet of mass 40 g is fired with a velocity 200 m s^–1& into a block of mass 4 kg which is placed at rest on the horizontal rough surface (the coefficient of friction, m = 0.6). Then the bullet embeds in the block and both start to move. Find the distance travelled by the system (bullet + block) before it comes to rest. (Take g = 10 m s^–2&)",0.33 m,6.5 m,2.75 m,1.25 m,,a,,MCQ
4,Dynamics,Assessment Test - III,,10,"Assertion (A) : In a tug of war game, the rope exerts less horizontal force on the losing team than on the winning team.
Reason (R)  : An unbalanced external force is necessary to cause motion in a body at rest.",A and R are true and R is the correct explanation of A.,"A and R are true, but R is not the correct explanation of A.",A is true but R is false,Both A and R are false,,c,,MCQ
4,Dynamics,Assessment Test - III,,11,"Assertion (A) : Equilibrium means either the body is at rest (static equilibrium) or in uniform motion (dynamic equilibrium).
Reason (R) : When the resultant force is zero or there is no unbalanced force, the body is said to be in equilibrium",A and R are true and R is the correct explanation of A.,"A and R are true, but R is not the correct explanation of A.",A is true but R is false,Both A and R are false,,a,,MCQ
4,Dynamics,Assessment Test - III,,12,"A space craft of mass M is moving with velocity V in free space explodes and breaks into two parts. After the explosion, a mass m of the space craft is left stationary. What is the velocity of the other part?",a,b,c,d,CH-4-12-ROW-133,a,,MCQ
4,Dynamics,Assessment Test - III,,13,"The figure shows force–displacement graph for a body moving along a
straight line. What is the total work done by the force?",10 J,6 J,4 J,2 J,CH-4-13-ROW-134,d,,MCQ
4,Dynamics,Assessment Test - III,,14,"A ball of 100 g strikes a rigid wall with a speed of 10 m s^–1& normally. When it returns, its velocity is decreased by 40% in the same straight line path. If the force exerted is 20 N, then find the time of contact?",0.16 S,0.2 S,0.08 S,0.4 s,,c,,MCQ
4,Dynamics,Assessment Test - III,,15,Match the statements of Column A with those of Column B.,A,B,C,D,CH-4-15-ROW-136,a,,MCQ
4,Dynamics,Assessment Test - IV,,1,A spring of force constant 1000 N m^–1& is streched initially by 2 cm from the equilibrium position. Find the amount of work needed to strech it further by 2 cm.,6 J,0.3 J,0.6 J,3 J,,c,,MCQ
4,Dynamics,Assessment Test - IV,,2,"If the momentum is increased by 40%, find the percentage increase in kinetic energy.",48%,96%,56%,80%,,b,,MCQ
4,Dynamics,Assessment Test - IV,,3,A bullet loses 1/10 of its velocity after penetrating a plank. How many such planks are required to stop the bullet?,10,8,12,5,,d,,MCQ
4,Dynamics,Assessment Test - IV,,4,A stationary particle of mass m explodes into two particles whose masses are m/4 and 3m/4 which move in opposite directions. What will be the ratio of kinetic energies?,1 : 3,1 : 9,9 : 1,3 : 1,,d,,MCQ
4,Dynamics,Assessment Test - IV,,5,A machine gun has a mass 4 kg. It fires bullets each of mass 40 g at the rate of 20 bullets per minute at a speed of 300 m s^–1&. What will be the force required to keep the gun in position?,8 N,12 N,4 N,1 N,,c,,MCQ
4,Dynamics,Assessment Test - IV,,6,Limiting friction is _________.,equal to dynamic friction,always greater than dynamic friction.,always less than dynamic friction.,some times greater and some times less than dynamic friction.,,b,,MCQ
4,Dynamics,Assessment Test - IV,,7,Two blocks of masses 2 kg and 6 kg are placed on a frictionless surfaces as shown in the figure. A force of 16 N is applied on 6 kg block. Find the force acting on 2 kg block,6 N,8 N,4 N,12 N,CH-4-7-ROW-143,c,,MCQ
4,Dynamics,Assessment Test - IV,,8,Which among the following is a wrong statement?,Action and reaction act on the same object.,Action and reaction are equal in magnitude,Action and reaction are opposite in direction.,None of the above,,a,,MCQ
4,Dynamics,Assessment Test - IV,,9,A body of mass m moving with a velocity v strikes another body of mass M which is at rest and gets embedded into it. The velocity of the system after collision is _________.,A,B,C,D,CH-4-9-ROW-145,b,,MCQ
4,Dynamics,Assessment Test - IV,,10,"Assertion (A) : A rocket moves forward by pushing the exhaust gas
backwards.
Reason (R) : It derives the necessary thrust to move forward according to Newton’s third law of motion.",A and R are true and R is the correct explanation of A.,"A and R are true, but R is not the correct explanation of A.",A is true but R is false,Both A and R are false,,a,,MCQ
4,Dynamics,Assessment Test - IV,,11,"Assertion (A) : On a rainy day, it is difficult to drive a car or bus at high
speed.
Reason (R) : The value of coefficient of friction is lowered due to wetting of the surface.",A and R are true and R is the correct explanation of A.,"A and R are true, but R is not the correct explanation of A.",A is true but R is false,Both A and R are false,,a,,MCQ
4,Dynamics,Assessment Test - IV,,12,"A person is standing in an elevator. In which of the following situations, does he find that his weight decreases?",When the elevator moves upwards with constant acceleration.,When the elevator moves downwards with constant acceleration.,When the elevator moves upwards with uniform velocity.,When the elevator moves downwards with uniform velocity.,,b,,MCQ
4,Dynamics,Assessment Test - IV,,13,A particle of mass m moving with velocity v collides elastically with a stationary particle of mass 2 m. Then the velocity of the particles after the collision is______. (Hint: Both law of conservation of energy and momentum hold good.),a,b,c,d,CH-4-13-ROW-149,a,,MCQ
4,Dynamics,Assessment Test - IV,,14,"A ball of mass 1 kg strikes a heavy rigid wall with a speed of 8 m s^–1& at an angle of 30^0&. It gets reflected with the same speed and angle as shown. If the ball is in contact with the wall for 0.1 s, what is the average force exerted on the ball by the wall?",40 N,20 N,120 N,80 N,CH-4-14-ROW-150,d,,MCQ
4,Dynamics,Assessment Test - IV,,15,Match the statements of Column A with those of Column B.,A,B,C,D,CH-4-15-ROW-151,b,,MCQ
5,Simple Machines and Gravitation,Assessment Test - I,,1,"Assertion (A) : The force required to open or close a window increases with decrease in the perpendicular distance between line of action and hinges about which the window rotates.
Reason (R) : Couple = force × arm of couple.",A and R are true and R is the correct explanation of A.,"A and R are true, but R is not the correct explanation of A.",A is true but R is false.,Both A and R are false,,a,,MCQ
5,Simple Machines and Gravitation,Assessment Test - I,,2,"Assertion (A) : In a practical simple machine work done by the effort is
always equal to the work done on the load.
Reason (R) : No energy is lost in a simple machine.",A and R are true and R is the correct explanation of A.,"A and R are true, but R is not the correct explanation of A.",A is true but R is false.,Both A and R are false,,d,,MCQ
5,Simple Machines and Gravitation,Assessment Test - I,,3,"In a screw jack, a lever of length 2 m is rotated once to lift the car of 1000 kg by 20 cm. What is the effort applied on the simple machine?",50/π kg wt,100/π N,100/π kg wt,50/π N,,a,,MCQ
5,Simple Machines and Gravitation,Assessment Test - I,,4,Match the statements of Column A with those of Column B.,a,b,c,d,CH-5-4-ROW-155,c,,MCQ
5,Simple Machines and Gravitation,Assessment Test - I,,5,"Two forces F~1* and F~2* act on a uniform rod at points A and B along the directions as shown in the figure. If the length of the rod is 3 m, then the magnitude and position of the resultant normal force that acts on it is _________.","50 N, 3 m from the end B","50 N, 3 m from the end A","50 N, 6 m from the end A","50 N, 6 m from the end B",CH-5-5-ROW-156,a,,MCQ
5,Simple Machines and Gravitation,Assessment Test - I,,6,"In a Roman steelyard, the weight of the Rider is 10 N and the scale is calibrated in mm. If the load is suspended 8 cm away from the point of suspension, then the least count of the instrument is _________. (Take g = 10 m s^–2&)",4 N,1/8 N,8 N,1/4 N,,b,,MCQ
5,Simple Machines and Gravitation,Assessment Test - I,,7,Which of the following is an example of neutral equilibrium?,A boat floating in turbulent water.,A foot ball floating in water.,A book placed on the table.,A buss moving on the road.,,b,,MCQ
5,Simple Machines and Gravitation,Assessment Test - I,,8,What is the acceleration due to gravity on the surface of a planet whose mass is same as the mass of the Earth and equal to the half of the radius of Earth? (Take g~earth* = 10 m s^–2&),15 m s^-2&,40 m s^-2&,20 m s^-2&,2.5 m s^-2&,,b,,MCQ
5,Simple Machines and Gravitation,Assessment Test - I,,9,"A bicycle, with two gears in its gear box has a crank wheel with 44 teeth. The wheels corresponding to 1^st& and 2^nd& gears have 22 and 11 teeth, respectively. If cyclist changes from 2nd gear to 1st gear maintaining constant rate of pedalling, then the speed of the bicycle is _________.
(Assume the bicycle moving on a horizontal road and the friction between the road and the bicycle is constant.)",decreases to 75%,increases to 50%,decreases to 50%,increases to 75%,,c,,MCQ
5,Simple Machines and Gravitation,Assessment Test - I,,10,The acceleration due to gravity at a depth equal to R/2 from the Earth’s surface is _________. (Let acceleration due to gravity on the Earth’s surface be g~0*),4/10g~0*,g~0*/4,2g~0*,g~0*/2,,d,,MCQ
5,Simple Machines and Gravitation,Assessment Test - I,,11,"A plank of length 5 m is used to drag a load of 100 N to two heights 1 m and 2 m, respectively. What is the percentage change in mechanical advantage in using plank in two cases? (Take g = 10 m s^–2*)",decreases to 50%,increases to 50%,decreases to 25%,increases to 50%,,a,,MCQ
5,Simple Machines and Gravitation,Assessment Test - I,,12,"An employee uses a wheel barrow to displace a load of 100 kg wt. If the load arm and effort arm are 1 m and 2 m, write the following steps in sequential order to find the effort applied.
(A) Substitute the values in the above formula and get the effort applied.
(B) Note the values of load, load arm and effort arm from the given data and convert them into S.I. system.
(C) Use the principle of lever, i.e., load × load arm = effort × effort arm",ABC,BCA,CBA,BAC,,b,,MCQ
5,Simple Machines and Gravitation,Assessment Test - I,,13,"Two satellites A and B revolve around the Earth at heights of h~1* km and h~2* km, respectively, from the ground. Write the following steps in a sequential order to find the ratio of acceleration due to gravity at heights h~1* and h~2*.",ABCDE,EDBCA,BACDE,CADBE,CH-5-13-ROW-164,c,,MCQ
5,Simple Machines and Gravitation,Assessment Test - I,,14,"The escape velocity on earth is 11.2 km s^–1&. If the mass and radius of the Earth becomes half, then the new value of its orbital velocity is  ________.",a,b,c,d,CH-5-14-ROW-165,c,,MCQ
5,Simple Machines and Gravitation,Assessment Test - I,,15,A body of mass 10 kg is made to hang from a spring. It stretches 10 cm on the Earth’s surface. The same body and the spring are taken on to some unknown planet whose size is same as the Earth but its mass is double the mass of the Earth. What is the extension of the spring on the planet?,2 cm,0.2 m,0.2 cm,0.1 m,,b,,MCQ
5,Simple Machines and Gravitation,Assessment Test - II,,1,"Assertion (A): Two equal but opposite couples acting on a single wheel does not produce turning effect.
Reason (R): The resultant couple acting on a body is equal to the  vectorial sum of the moments of individual couples acting on it.",A and R are true and R is the correct explanation of A.,"A and R are true, but R is not the correct explanation of A.",A is true but R is false.,Both A and R are false.,,a,,MCQ
5,Simple Machines and Gravitation,Assessment Test - II,,2,"Assertion (A): Mechanical advantage (MA) of a simple machine is always greater than one.
Reason (R): MA = Load / Effort",A and R are true and R is the correct explanation of A.,"A and R are true, but R is not the correct explanation of A.",A is true but R is false.,Both A and R are false.,,c,,MCQ
5,Simple Machines and Gravitation,Assessment Test - II,,3,"The radius of a wheel is 70 cm and that of the axle is 14 cm. If the maximum load that can be lifted using wheel and axle is 7000 N, then the required effort to perform the task is _________. (Take g = 10 m s^–2&)",1700 N,70 Kg wt,140 N,140 Kg wt,,d,,MCQ
5,Simple Machines and Gravitation,Assessment Test - II,,4,Match the statements of Column A with those of Column B.,a,b,c,d,CH-5-4-ROW-170,a,,MCQ
5,Simple Machines and Gravitation,Assessment Test - II,,5,"A uniform metallic rod AB of length 2 m is acted upon by two forces F~1* and F~2* of magnitudes 100 N and 80 N, respectively, along the directions as shown in the figure. What is the magnitude of the resultant normal force acting on the rod (in N)?",53.28,106.56,205.63,3675,CH-5-5-ROW-171,b,,MCQ
5,Simple Machines and Gravitation,Assessment Test - II,,6,"In a Roman steelyard, the length of the scale is 1.5 m and the weight of the rider is 20 N. The load is suspended 15 cm away from the point of suspension, then the maximum load that can be measured by it is _________. (Take g = 10 m s^–2&)",20 kg wt,20 N,2 N,2 kg wt,,a,,MCQ
5,Simple Machines and Gravitation,Assessment Test - II,,7,Which of the following is an example of stable equilibrium?,A ball rolling on a smooth floor.,A lorry moving along a curved path within safe limit.,A rubber ball floating in a water.,A circus artist riding bicycle on a single tyre.,,b,,MCQ
5,Simple Machines and Gravitation,Assessment Test - II,,8,"The mass and radius of a planet are eight times and two times the mass and radius of the Earth, respectively. Then, the acceleration due to gravity of the planet is _________ times the acceleration due to gravity on the Earth. (Take g = 10 m s^–2&)",Eight,Four,Two,Three,,c,,MCQ
5,Simple Machines and Gravitation,Assessment Test - II,,9,"A bicycle has a crank wheel with 66 teeth and two gears in its gear box. If wheels corresponding to 1^st& and 2^nd& gears have 44 and 22 teeth, respectively, and cyclist riding the bicycle changes from 1^st& gear to 2^nd& gear maintaining same rate of pedaling, then the speed of the bicycle _________.
(Assume the road to be horizontal and the friction between the types of bicycle and road is constant.)",increases by 100%,increases to 50%,decreases by 50%,increases to 300%,,a,,MCQ
5,Simple Machines and Gravitation,Assessment Test - II,,10,What is the acceleration due to gravity at a height equal to R/2 from the Earth’s surface?,a,b,c,d,CH-5-10-ROW-176,d,,MCQ
5,Simple Machines and Gravitation,Assessment Test - II,,11,"Two planks A and B of lengths 2 m and 4 m, respectively, are used to drag 10 kg wt load to a height of 1 m from the ground. What is the percentage increase in mechanical advantage when the plank A is changed to B? (Take g = 10 m s^–2&)",50%,100%,200%,400%,,b,,MCQ
5,Simple Machines and Gravitation,Assessment Test - II,,12,"A worker uses a crow bar to move a boulder of weight 100 kg wt. If the
length of crow bar is 2 m and effort arm is 0.3 m, then write the following steps in sequential order to find the effort needed to be applied.
A) Find the load, effort arm, length of crow bar from the given data.
B) Use the principle of lever, i.e., load × load arm = effort × effort arm.
C) Here, load arm = length of crow bar – length of effort arm.
D) Substitute the values in the above formula and find the effort required.",ACBD,ABDC,CDAB,CBDA,,a,,MCQ
5,Simple Machines and Gravitation,Assessment Test - II,,13,"Two bodies A and B of masses 10 metric tonn and 20 metric tonn are placed at a distance of 100 m. Now a body C of mass 1 kg is placed in between A and B such that it experiences equal force of attraction by both A and B.
Write the following steps in a sequential order to find the distance of body C from body A.",ADBCE,ABDEC,CEDAB,EACBD,CH-5-13-ROW-179,b,,MCQ
5,Simple Machines and Gravitation,Assessment Test - II,,14,"The escape velocity on earth is 11.2 km s^–1&. If the mass and radius of the Earth are doubled, then the new value of its orbital velocity is _________.",A,B,C,D,CH-5-14-ROW-180,a,,MCQ
5,Simple Machines and Gravitation,Assessment Test - II,,15,"A body of mass 1 kg is made to hang from a spring. If it is stretched by 10 cm on the Earth’s surface, then the extension in the spring when it is taken to the surface of the Moon is _________. (Take g~m* = 1/6 g~e*)",0.016 cm,1.6 m,0.16 cm,1.6 cm,,d,,MCQ
6,Simple Machines ,Assessment Test - I,,1,Which among the following can act as a I order as well as II order lever?,Scissors,Seesaw,Nutcracker,Crowbar,,d,,MCQ
