ChapterName,TestNumber,QuestionNumber,QuestionDescription,Option1,Option2,Option3,Option4,Image?
Wave Motion and Sound,Assessment Test III,4,"Match the statements of Column A with those of Column B
(A) Loudness       (a) Group of wave length
(B) Pitch              (b) Single wave length
(C ) High quality   (c ) Amplitude
(D) Low qulaity    (d) Frequency","A→c;    B→d,    C→b;     D→a","A→c;    B→d,    C→a;     D→b","A→d;    B→c,    C→b;     D→a","A→d;    B→c,    C→a;     D→b",
Wave Motion and Sound,Assessment Test III,5,Two persons are talking behing the wall. We can differentiate their voices by _________ evne if their pitch an amplitude are equal.,loudness,quality,timbre,Both (b) and ©,
Wave Motion and Sound,Assessment Test III,6,The oscillation of a simple pendulum is graphically represented as shown in figure. The frequency of the simple pendulum is _______ Hz.,4,0.5,0.25,  1/6,X
Wave Motion and Sound,Assessment Test III,7,"A wave of time period of 20 ms travels with a velocity of 2 m s-1 If the time period of another wave is 5 ms, then velocity of second wave and the ratio of their velocity are (wave length of the two waves is same)______ and respectively.","0.8 m s-1, 7/2 ","0.25 m s-1, 5/2 ","8 m s-1, 1/4",None of these,
Wave Motion and Sound,Assessment Test III,8,"A sound wave is traveling from air to water. The velocity of the sound waves in air is 340 m S-1 and wavelength is 2m. If the wave length of the sound wave in water is 1050 cm, then its velocity of wave in water is _____.",1785 m s-1,1.785 m s-1,1.785 pm s-1,1585 m s-1,
Wave Motion and Sound,Assessment Test III,9,"When a string fixed between two end is plucked, a wave propagates along the string and relfects at the other end. If the velocity and frequency of the wave is 330 m s-1 and 1200 Hz, then the distance of first node and first anti-node from the fixed end of the string are _______ and ______, respectively.","0.1375m, 0.6875 m","0.138 m, 0.6 m","0.1375 m, 0.06875 m",None of these,
Wave Motion and Sound,Assessment Test III,10,"If the length of a seconds pendulum is first decreased by 10cm and its time period is measured and then increased by 15 cm and the time period is measured, then the ratio of the time periods in two cases is _______ (Take g = 9.8 s-2)",6 : √‾7, √‾6 : 7,√‾42 : 1, √‾6 : √‾7,
Wave Motion and Sound,Assessment Test III,11,"When you speak to your friend, which of the following paramenters has a unique value in the sound produced?",frequency,velocity,amplitude,wavelength,
Wave Motion and Sound,Assessment Test III,12,"The time period of a pendulum on the surface of a planet is 8 s and same simple pendulum is a second pendulum on the Earth surface. What is the value of x, if the acceleration due to gravity of the planet is 1/x times of that of the earth?",16,8,4,2,
Wave Motion and Sound,Assessment Test III,13,"The velocity of sound increases by 50% when it enters a liquid from air and when it enters another liquid from air, increase in velocity is 150%. What is the ratio of % increase in the wavelength in two cases?", 1 : 1, 1 : 2, 1 : 4, 1 :3,
Wave Motion and Sound,Assessment Test III,14,The length of a second pendulum on the Earth to be decreased to make it as a seconds pendulum on the surface of the Moon is _______ time its length on the Earth., 1/6, 11/6, 5/6 , 7/ 6,
Wave Motion and Sound,Assessment Test III,15,Two sound waves 'P' and 'Q' travel with amplitude 3 mm and 4 mm. What is the ratio of their loudness?, √‾3 : 2,  9 : 16,2: √‾3, 16 : 9,
Wave Motion and Sound,Assessment Test IV,1,"The time taken by a particle to move from one extreme position to the other extreme position is 0.1s. If the distance between two adjacent crests is 1.5m, write the steps in sequential order to determine the velocit of the wave.
(A) Note down the wavelength (h) 
(B) Find the frequency (f)
(C ) Note down the time period (T)
(D) Find the velocity by the formula v = fh",BCAD,CBAD,ABCD,ACBD,
Wave Motion and Sound,Assessment Test IV,2,"What is the wavelength, if the distance between one crest to the next trough of a wave is 12.5 cm?",25m,25 cm,2.5 m,None of these,
Wave Motion and Sound,Assessment Test IV,3,The musical instrument in which a membrance is excited to produce musical notes is called _______ instrument.,flute type,reed type,stringed,percussion,
Wave Motion and Sound,Assessment Test IV,4,"Match the statements of Column A with those of Column B
(A) Pitch                       (a) Hertz
(B) Wavelength             (b) Centimetre
(C ) Loudness               (c ) No unit
(D) Amplitude               (d) Decibel","A→c;    B→b,    C→d;     D→b","A→a;    B→b,    C→d;     D→b","A→c;    B→d,    C→b;     D→a","A→c;    B→d,    C→a;     D→b",
Wave Motion and Sound,Assessment Test IV,5,"If the loudness of sound of two persons is equal, then ________.",Their frequency of sound is equal ,Their amplitude of sound is equal,Their quality of sound is equal,Both (a) and (b),
Wave Motion and Sound,Assessment Test IV,6,"The frequency and amplitude of simple pendulum are 2 Hz and 4 cm, respectively. What is the suitable graph for this simple pendulum?",x,x,x,x,
Wave Motion and Sound,Assessment Test IV,7,"A wave of frequency 100 Hz travels with a velocity of 3 m s-1. If the time period of another wave is 8 ms, then its velocity and also the ratio of their velocities are ______ (Assume that the wavelength of the two waves is the same)."," 30/8 m s-1, 5/2"," 30/8 m s-1, 4/5"," 30/8 m s-1, 2/5",None of these,
Wave Motion and Sound,Assessment Test IV,8,"A sound wave is traveling from air to glass. The velocity of the sound  in air is Va and wavelength is ha. What is the velocity in glass, if the wave length of the sound wave in the glass is hg?",ha vg/ va,hg vg/ ha,ha va/ vg,ha va/ hg,
Wave Motion and Sound,Assessment Test IV,9,"When a string fixed between two end is plucked, a wave propagates along the string and relfects at the other end. If the frequency and distance of the first anti-node from first end of the string are 1000 Hz and 2m, respectively, the velocity of the wave is ______________",8000m s-1,8000cm s-1,8 x 10-3 cm s-1,9000m s-1,
Wave Motion and Sound,Assessment Test IV,10,"The length of a second pendulum is first decreased by 10cm and its time period is found, then increased x cm and its time period is found. If the ratio of time periods in two cases is √‾3 : 2, then find the value of x",10,20,30,40,
Wave Motion and Sound,Assessment Test IV,11,"When a sound wave is traveling from one medium to another medium, which of the following parameters have a unique value in the sound progation?",frequency,wavelength,Velocity,Speed,
Wave Motion and Sound,Assessment Test IV,12,"The time period of a simple pendulum is 4 s on the surface of the earth. What is the length of the pendulum (in m), if it takes 2.3s to complete one oscillation on the surface of the planet whose 'g' value is thrice that of the earth ? (Take n2 =g)",1,2,3,4,
Wave Motion and Sound,Assessment Test IV,13,The velocity of sound increases by 75% when it enters a liquid from air and their is  a 25% increase in the wavelength when it enters into another liquid from the first liquid. The velocity of sound in the second liquid is ________ if the velocity of sound in 1m liquid is 1100 m s-1.,"1,275 ms-1","1,375 ms-1","1,375 cms-1","1,275 cms-1",
Wave Motion and Sound,Assessment Test IV,14,"The time period of a simple pendulum on the surface of the Earth is 5 s. To maintain the same time period on the surface of the planet of g value twice that of the earth, the change in the length of the pendulum is _________ (Take the value of acceleration due to gravity on the Earth as n2)",6.25 m,6.25 cm,62.5 nm,62.5 pm,
Wave Motion and Sound,Assessment Test IV,15,"The % increase in the amplitude of sound is 20%, then % change in loudness is ________",11,22,33,44,
Light,Assessment test I,1,"A light ray incident on a reflecting surface with an angle of incident of 30°, The angle of deviation is_______,",60°,30°,120°,90°,
Light,Assessment test I,2,What is the nature of the images formed by a plane mirror ?,real,magnified,virtual,diminished,
Light,Assessment test I,3,"what is the number images formed, when the angle between two mirrors is  72° ?",4,5,6,3,
Light,Assessment test I,4,"A light ray travelling from medium 'A' to medium'B'undergoes refraction and another light ray travelling from 'A' to 'C' undergoes reflection. If A,Band C are transparent media and μA, μB and μC are their refractive indices, which of the following is necessarily true? ",μA > μB,μA < μB,μB > μC,μB < μC,
Light,Assessment test I,5,"A light ray travels through three media A,B, and C as shown below. If ʋA,ʋB and ʋC are the velocities of the light in A,B,C respectively, then ",ʋB > ʋA,ʋB > ʋC,ʋC > ʋA,ʋB > ʋC,X
Light,Assessment test I,6,"Assertion (A) :When vissible light is passed through a pris, violet colour is seen at the bottom of the screen.
Reason( R ) : prism has the highest refractive index for voilet light.",A and R are true and R is the correct explanation of A.,A and R are true but R is not the correct explanation of A.,A is true but R is false.,Both A and R are false.,
Light,Assessment test I,7,"Assertion (A) :A convex lens placed in air always forms a real images.
Reason( R ) : Any light ray passing through a convex lens is converged.",,,,,
Light,Assessment test I,8,"objects are placed infront of a convex lens of local length 20 cm at the following positions, Arrange these positions in the increasing order of the size of their image.
(A) At 2F1  
 (B) At F1 
(C) Between 2F1 and F1
 (D) Infinity ",,,,,
Light,Assessment test I,9,a light ray travells from air to four different media as shown below. Arrange them in the increasing order of wave length of light rays in these media.,ACBD,DBCA,DCDB,CBDB,X
Light,Assessment test I,10,"Match the statements of Coloumn A with those of Coloumn B
(A) Blue colour of Sky                                  (a) Total internal reflection
(B)  Mirage                                                    (b) Scattering of light
(C)  Twinkling of Stars                                  (c) Dispertion
(D) Formation of  rainbow                             (d) Refraction","A -> b;  B -> a; C -> d, D -> c","A -> a;  B -> b; C -> c, D ->d","A -> b;  B -> c; C -> b, D -> a","A ->c;  B -> d; C -> b, D -> a",
Light,Assessment test I,11,Which of the following takes place in periscopes in which prisms are used.,refraction,total internal reflection,reflection,scattering,
Light,Assessment test I,12,"The velocities of light through media 'A' and 'B' are V and 2V, respectively, The value of sin C is ________[ where 'C' is the critical angle].",1/2.,1/3.,3,2,
Light,Assessment test I,13,An object of height 5 cm is placed infront of a convex lens of local length 20cm at a distance of 30 cm. what is the height of the image (in cm)?,20,30,10,40,
Light,Assessment test I,14,The focal length of a eye lens is ʄ. What is the value pof the diameter of the eye ball?,ʄ,2ʄ,3ʄ,ʄ/2,
Light,Assessment test I,15,A glass slab of thickness 5 cm and refractive 3/2 is placed over a photo. The apparent shift in position of the photo is _________cm.,7/3.,5/3.,5/2.,5/4.,
Light,Assessment test II,1,"When a light ray incident on a reflecting surface, the angle of deviation is found to be 90°. What is the value of the angle of reflection?",45°,90°,160°,120°,
Light,Assessment test II,2,"Image formed on a convex mirror is ___________.
(A) real  (B) magnified (C) virtual  (D) dimished",,,,,
Light,Assessment test II,3,The number of images formed by the combination of two mirrors is 9. What is the angle between the two mirrors ?,36°,40°,90°,both (a) and (b),
Light,Assessment test II,4,"When a light ray travells from a medium P and Q,  it undergoes total internal reflection. Then, avoiding normal incidence _________",any light ray travelling from P to Q undergoes reflection,any light ray travelling from Q to P undergoes reflection,any light ray travelling from Q to P undergoes refraction,None of these,
Light,Assessment test II,5,"A light ray travels from medium P to Q and R as shown below. If μP, μQ and μR are the refractive indices of the media P,Q and R, respectively, then find the relation between them.   ",μP > μQ,μR > μQ,μR > μP,μP > μQ,X
Light,Assessment test II,6,"Assertion (A) : Voilet and red light entering from air, traveling same distance through a glass slab travel for same time interval.
Reason (R ) : Velocities of voilet and red light travelling through glass slab are same.",A and R are true and R is the correct explanation of A.,A and R are true but R is not the correct explanation of A.,A is true but R is false.,Both A and R are false.,
Light,Assessment test II,7,"Assertion (A) : A convex lens placed in air always forms virtual image
Reason (R ) : Any light ray passing through a concave lens is diverged.",A and R are true and R is the correct explanation of A.,A and R are true but R is not the correct explanation of A.,A is true but R is false.,Both A and R are false.,
Light,Assessment test II,8,"When an object is moved away from a convex mirror, what happens to the image?",becomes smaller,moves closer to the focus,becomes inverted,Both (a) and (b),X
Light,Assessment test II,9,A light ray travels from a medium 'm' to four different media as shown below. Arrange them in the increasing order of critical angle. ,ABCD,DCBA,CABD,DBAC,
Light,Assessment test II,10,"Match the statements of coloumn A with those of coloumn B,
      Coloumn A                                                                   Coloumn B
(A) Optic fibre communicatio                        (a) Reflection
(B)  Apparent depth of swimming pool          (b) Scattering 
(C)  Formation of image by a plane mirror     (c) Total internal reflection
(D) Orange colour of Sky                              (d) Refraction",,,,,
Light,Assessment test II,11,The periscopes in which mirror are used. __________ takes place,reflection,total internal reflection,refraction,scattering,
Light,Assessment test II,12,"The Critical angle of a pair of media is 'C'. If velocity of light through the denser medium is V, the velocity of the light through the rarer medium is _______,",,Sin,,V Sin C,
Light,Assessment test II,13,"When an object of height 3 cm is placed infront of a convex lens of focal length 20 cm, the height of the real image is found to be 6cm. What is the distance between the object and image?",20,30,10,40,
Light,Assessment test II,14,"The focal length of the defective eye lens of a person is less than the diameter of the eye ball. Then the person is suffering from ________,",short sightedness,long sightedness,defect in cornia nerves,defect in optical nerve,
Light,Assessment test II,15,"A bird is flying horizontally above a swimming pool at a distance of 30m above the surface of water. If the refractive index of water is 4/3, the apparent shift in position of the bird's image is _______, ",10 m,20 m ,15 m,12 m,
Light,Assessment test III,1,Choose the correct statement (S),An object is visible only if the light is reflected from it,Light is the only form of energy which causes the sensation of vision.,Formation of a shadow is due to the rectilinear propogation of light.,All of the above,
Light,Assessment test III,2,"The Point of intersection of reflected rays is _______,",a real object,a real image,a virtual image,a virtual object,
Light,Assessment test III,3,"An optical instrument is placed inside the box as shown below. The incident rays and emergent rays are also shown. The optical instrument could be _____,",Only a plane mirror,only a convex mirror,only a concave mirror,both plane mirror and convex mirror,X
Light,Assessment test III,4,Light rays are incident onb a plane mirror as shown below. What is the image distance with proper sign convertion ?,+20 cm,-20 cm,+40 cm,-40 cm,X
Light,Assessment test III,5,A concave mirror of focal length 30 cm forms a real image whose size is thrice the size of the object which is at the distance of _______cm.,60,50,40,70,
Light,Assessment test III,6,What should be the shift in the position of a plance mirror so that the shift in position of the image is 20 cm towards the mirrors?,20 cm,40 cm,10 cm,80 cm,
Light,Assessment test III,7,The velocity of light in air is 3 x        m       . What is the velocity of light in a medium whose refractive index is 1.8?,1.6 x        m ,1.32 x        m ,2.22 x        m ,2.8 x        m ,
Light,Assessment test III,8,"When a person suffering from long sightedness looks at an object very close to him, the image distance of the eye lens is ______ that of a normal eye.",lesser than,equal to,greater than,half of,
Light,Assessment test III,9,"In the outer space, the sky appears _________,",blue due to scattering,Orange due to refraction,dark as there is no scattering,while as there is no scattering,
Light,Assessment test III,10,"Match the statements of coloumn A with those of coloumn B,
Coloumn A                                                        Coloumn B
(A) Scatering                                  (a) Twinkling of stars
(B)  Total internal reflection         (b) Formation of image by a plane mirror
(C) Refraction                                 (c) Sparking of diamond
(D) Reflection                                 (d) Blue colour of the sky",,,,,
Light,Assessment test III,11,"Arrange the following steps of an experiment to determine the focal length of a concave mirror in proper order.
(A) Focus the mirror to a distant object
(B) Place the concave mirror on a V shaped stand
(C ) Measure the distance between the screen and the mirror
(D) Adjust the position of the screen, such that a clear image is formed on it",,,,,
Light,Assessment test III,12,"A convex lens made of glass, with refractive index 3/2, is placed in a medium of refractive index 5/2, A parallel beam of light entering the lens ______,",diverges,converges,undergoes no refraction,comes out as a parallel beam by itself.,
Light,Assessment test III,13,"The height of the image of an objject placed in front of a convex lens is 4 cm, If the magnification produced by the lens is -2, the height of the object is ______ cm and it is a _______ image.","2, real","8, real","8, virtual","2, virtual",
Light,Assessment test III,14,"The critical angle of a prism is 42°, Choose the correct statement of a light ray incident on a prism as shown below.",The angle of refraction on the surface AB is 30°,The angle of reflection on the surface AB is 60°,The angle of reflection on the surface AB is 30°,The angle of refraction on the surface AB is 42°,X
Light,Assessment test III,15,"If a coin is placed at the bottom of a tank filled with water, upto a height 2m, it appears to be at a depth of ________from the surface of the water. (Refractive index of water is = 4/3) ",3/4.,2/3.,4/3.,3/2.,
Light,Assessment test IV,1,Choose the wrong statement (S),The formation of an image is always due to the reflection,Real images can not be formed due to the reflection of light,The formation of a real image is always due to the refraction of the light rays.,All of the above,
Light,Assessment test IV,2,"The point of intersection of incident rays is _________,", a real object,a real image,a virtual image,a vertual object,
Light,Assessment test IV,3,"An optical instrument is placed inside a box as shown below. The incident rays and emergent rays are also shown. The optical instrument could be _______,",a convex mirror,a concave mirror,a concave lens,either a concave lens or a convex mirror,X
Light,Assessment test IV,4,Converging light rays incident on a convex mirror is as shown below. What is the image distance with proper sign convention ?,+10 cm,-10 cm,+20 cm,-20 cm,X
Light,Assessment test IV,5,A convex mirror of focal length 20 cm forms an image whose size is one third of the size of the object. The object distance is ________cm.,60,40,50,80,
Light,Assessment test IV,6,A plane mirror is shifted towards an object by 5 c. What is the shift in position of the image?,5 cm,10 cm,20 cm,40 cm,
Light,Assessment test IV,7,"The velocity of light in two media 'X' and 'Y' are 10^8 m s6-1 and 1.5 x 10^8 m s^-1, respectively. The refractive index of Y with respect to X is ________,",,2,,,
Light,Assessment test IV,8,"When a person suffering from short sightedness looks at an object at infinite distance, the focal length of the eye lens is _______ that of a normal eye.",equal to,lessthan,greater than,double,
Light,Assessment test IV,9,"In the evening hours, Sky appears _______, ",Orange or red as light rays travel long distance,blue due to the scattering of light with lower wavelength,dark as there is no scattering taking place in the sky,white as there is no scattering taking place in the sky,
Light,Assessment test IV,10,"Match the statements of coloumn A with those of coloumn B,
    Coloumn A                                                    Coloumn B
(A) Dispersion                                             (a) Mirage
(B)  Scattering                                             (b) pin hole camera 
(C)  Total internal reflection                          (c) Red light used as traffic signal
(D) Rectilinear propagation                           (d) Rainbow",,,,,
Light,Assessment test IV,11,"Arrange the following steps to determine the focal length of a convex lens in proper order.
(A) Focus the lens to a distant object
(B) Measure the distance between the lens and the screen
(C ) Place the lens on a stand.
(D) Adjust the position of the screen to obtain a clear image on it.
",CABD,CBAD,CADB,CBAD,
Light,Assessment test IV,12,"A Concave lens made of a material of refractive index 3/2 is placed in atransparent liquid of refractive index 1.8. A parallel beam of light rays after passing through the lens ________,",diverges,converges,undergoes not refraction,emerges out as a parallel beam itself.,
Light,Assessment test IV,13,"The height of the object placed in front of a convex lens is 20 cm. if the magnification is +3, the height of the image is _________cm and it is formed in the _________side of the object.","60, same","60, opposite","20/3, same","20/3, opposite",
Light,Assessment test IV,14,"The critical angle of the prism shown below is 42°, If the light ray enter a prism as shown below, Choose the correct statement. 
(A) Light ray emerges out from the side AC
(B) Angle of deviation is 180°
(C ) Light ray does not undergo any refraction on the surface AB.",,,,,X
Light,Assessment test IV,15,A stamp placed under a glass slab appears to be at a distance 4 cm from the top surface. Then the thickness of glass slab is ______cm. ( Refractive index of glass = 3/2),16,9,6,8,
Electricity,Assessment Test I,1,What happens when a glass rod is rubbed with silk cloth?,the electrons flow from glass rod to silk cloth.,the glass rod becomes a negatively charged body.,the glass rod becomes a positively charged body.,Both (a) and (c),
Electricity,Assessment Test I,2,"What happens when two identical bodies 'A' and 'B', which have +10 C and +5 C, respectively, are connected to each other by means of a metal wire?",the conventional current flows from A to B.,the electronic current flows from A to B.,the electronic current flows from B to A.,Both (a) and (c),
Electricity,Assessment Test I,3,"An electrical conducting wire (ABCD) of negligible resistance is connected parallel to the resistor of R = 100Ω as shown in the figure. If 2 x 10¹³ electrons are pushed into the the circuit in every one second, then the current flowing through the conductor (ABCD) is __________________. (charge of an electron = 1.6 x 10⁻¹⁹)",8 x 10⁻⁶ A,1.6 x 10⁻¹³,1.6 x 10⁻⁶ A,3.2 x 10⁻⁶ A,x
Electricity,Assessment Test I,4,An electric device of 50 W is made to run for 20 h per day. If one unit costs ₹ ______________ .,125,150,75,50,
Electricity,Assessment Test I,5,In which of the following electric circuits does the electric bulb shown glow?,x,x,x,x,
Electricity,Assessment Test I,6,"Assertion (A) : When current is supplied by a cell, the cell gains electrons. Reason (R): The number of electrons coming out of the cell to the circuit is equal to the number of electrons entering the cell from the circuit.",A and R are true and R is the correct explanation of A.,"A and R are true, but R is not the correct explanation of A.",A is true but R is false.,Both A and R are false.,
Electricity,Assessment Test I,7,Assertion (A) : Mica sheets are placed on either side of the heating elemet. Reason (R): Mica does not conduct electricity but transfer the heat.,A and R are true but R is the correct explanation of A.,"A and R are true, but R is not the correct explanation of A.",A is true but R is false.,Both A and R are false.,
Electricity,Assessment Test I,8,"Match the statement of Column A with those of Cloumn B.
Column A Column B
A. Chemical decomposition reaction a. NH₄Cl
B. Dichromate cell. b. Metallugical applications.
C. Chemical effect of electricity c. Electrolyte
D. Leclanche cell d. K₂Cr₂O₇ + H₂SO₄",A → a; B → d; C → c; D → b,A → a; B → d; C → d; D → c,A → c; B → d; C → b; D → a,A → c; B → b; C → d; D → a,
Electricity,Assessment Test I,9,"Two identical copper coins are melted and two wires 'A' and 'B' are made out of them. What is the resistance of B, if the lenght of A is twice that of B?",equal to the resistance of A,equal to half the resistance of A,equal to quarter the resistance of A,equal to 1/8 times the resistance of A,
Electricity,Assessment Test I,10,An electric fan consumes 1500 J of electrical energy in half-minute. The power of the fan is __________ .,50 watt,150 J s¹⁻,45 watt,200 J s¹⁻,
