ChapterName,TestNumber,QuestionNumber,QuestionDescription,Option1,Option2,Option3,Option4,Image?
Dynamics,Assessment Test I,2,"The velocity of a body changes from xms-1 to  yms-1 in t s under the action of constant external force. Arrange the following steps in sequential order to calculate the magnitude of external froce acting on the body.
(A) Determine the change in velocity , (y-x) ms -1.
(B) The magnitude of external force acting on the body is x(y-x)/t N.
(C) Let m be the mass of the body
(D) The rate of change in velocity is acceleration of the body, that is, (y-x/t) ms-2 .",CADB,DCAB,BCAD,ABCD,
Dynamics,Assessment Test I,3,"Match the statements of Column A with those of Coloumn B.
(A) Frictinla force between hightly                                                                (a) Outside th body
(B) Interaction between protons and neutrons                                                (b) Increases
(C ) Centre of gravity of an annular ring                                                         (c) Decreases
(D) When a person standing on a swing sits, the height of centre of gravity      (d) Nuclear forces
                                                                                                                     (f) Electromagnetic forces",A→ c; B→f; C→e; D→b;,A→ b; B→f; C→e; D→c;,A→ b; B→d; C→a; D→c;,A→ b; B→d; C→ e; D→ c;,
Dynamics,Assessment Test I,4,"Assertion (A): The work done by the gracity on an ascending body is negative.
Reason (R ): The displacement and gravitational force are opposite in direction.",A and R are true and R is the correct explanation of A.,"A and R are true, but R is not the correct explanation of A.",A is true but R is false.,Both A and R are false.,
Dynamics,Assessment Test I,5,"Assertion (A): When a person swims, he pushes the water in the same direciton as his motion.
Reason (R ): Both action and reaction act on the same body.",A and R are true and R is the correct explanation of A.,"A and R are true, but R is not the correct explanation of A.",A is true but R is false.,Both A and R are false.,
Dynamics,Assessment Test I,6,"To make two bodies A and B experience an equal acceleration, forces 6N and 4 N are applied, respectively. If the bodies are combined, then to produce the same acceleration, the force applied should be ____________ N.",1,3,6,10,
Dynamics,Assessment Test I,7,Weightlessness is experienced by ____________,a person durng his free fall,astronauts on moon,a person who experiences reation force,a person during climbing a hill,
Dynamics,Assessment Test I,8,"If a mass of a body is increase by 20%, then the momentum of body remains same, if the velocity approximately________",decreased by 17%,increased by 17%,decreased by 83%,increased by 32%,
Dynamics,Assessment Test I,9,"Two spheres moving in opposite direction along a stright line can interchange their velocities on colliding with each other, if ________",the magnitudes of their velocities before collision are equal.,their masses are equal,their momenta before collision are equal.,their accelerations are equal.,
Dynamics,Assessment Test I,10,"A ball of mass 200 g moving with a speed of 2ms-1 hits a wall normally and bounces back with the same speed. If the ball is in contact with the wall for 2 millisecond, the force exerted on the ball is _________ N.",200,400,600,800,
Dynamics,Assessment Test I,11,"To lift a body vertically up from the surface of the Earth through a certain height, 20 J of work is required. If the same body is lifted uup vertically through an equal height on the surface of the Moon, then the work required is _________ J.
g moon= g earch/6",2.22,3.33,4.44,5.65,
Dynamics,Assessment Test I,12,A rod of 4m length is bent in the form of a square. What is the distance of the centre of gravity to any one of the vertices (in m)?,1,01/Jan, 1/2, 1/3,
Dynamics,Assessment Test I,13,"A load of 10 kg weight is suspended at one end of a lever which is pivoted on a fulcrum at the other end, as shown in the given figure. What should be the effort (P) (in N), if we apply the effort at the centre of lever to balance it? (g = 10 m s-2) ",200,300,400,500,X
Dynamics,Assessment Test I,14,"If a body of mass 5 kg is dragged along the frictinless inclined plane shown in the figure, then the effort (p) required to drag the body is ____________ (g=10 m s-2)",3X106 dyne,30 dyne,3N,3X102 N,X
Dynamics,Assessment Test I,15,"What is the efficiency of the pulleys, if the pulleys used in following system are frictionless and the string used is massless?",0.8,1,0.5,0.25,X
Dynamics,Assessment Test II,1,"Arrange the following steps in proper order to find the height of centre of gravity from the base of an equilateral triangular lamina.
(A) Centroid divides the median in the ration 2:1, so divide the median in the ration 2:1 and find the length of the two parts.
(B) Find the height of the median using Pythagoras therorem.
(C) Divide the equilateral triangle into two right angel triangles by drawing a median on its base.
(D) Centre of gravity of an equilateral triangular lamina lies at its centroid.
(E) The height of centroid from the base gives the height of centre of gravity from the base of the triangle.",BCDEA,DABCE,DBCEA,DCBAE,
Dynamics,Assessment Test II,2,"A crow bar of length 1.5m is used to lift a load of 75 kg weight by placing  the fulcrum at a distance of 20 cm from the load . Arrange the following steps is sequential order to find the effort (in N) applied on the crow bar to lift the load.
(A) Substitute the values in the law of levers, i.e., load x load arm = effort x effrot arm.
(B) The distance between the load and the fulcrum is taken as load arm.
(C) Convert the load into newton by multiplying with g and convert the length of crow bar into cm.
(D) By substracting the load arm from the length of the crow bar, we will get the length of effort arm.
(E) Determine the effort, i.e. Effort = load x loar arm / effort arm",CDABE,CADBE,CBDAE,ADCBE,
Dynamics,Assessment Test II,3,"Match the statements of Column A with those of Coloumn B.
(A) Stream linging of bodies                                                            (a) Neutral equilibrium
(B) Centre of gravity of boomerang                                                  (b) Within the body
(C ) A cylindrical vessel resting on a cruved surface                          (c) Friction is removed
(D) Centre of gravity of a solid right circular cone resting on its base (d) Minimized friction
                                                                                                       (e) Outside the body
                                                                                                       (f) Unstable equilibrium",A→ c; B→c;  C→f;  D→b;,A→ d; B→c; C→a; D→b;,A→ d; B→b; C→f; D→e;,A→ c; B→c; C→b; D→f;,
Dynamics,Assessment Test II,4,"Assertion (A) : Work done by a force acting on a body towards the centre of a circular path is zero.
Reason (R ): The direciton of force is perpendicular to its displacement.",A and R are true and R is the correct explanation of A.,"A and R are true, but R is not the correct explanation of A.",A is true but R is false.,Both A and R are false.,
Dynamics,Assessment Test II,5,"Assertion (A) : When a person steps out of a boat, the boat moves bacwards.
Reason (R ) : The reation force acting on the boat is in the opposite direction to the direction of movement of the person.",A and R are true and R is the correct explanation of A.,"A and R are true, but R is not the correct explanation of A.",A is true but R is false.,Both A and R are false.,
Dynamics,Assessment Test II,6,"A force can produce an acceleration of 2m s-2 and 6 m s-2 on bodies A and B, respectively, when applied individually. What is the acceleration produced (in m s-2), if the bodies are combined and the same force is applied?",1..0,1.5,3..0,6..0,
Dynamics,Assessment Test II,7,"Consider the Moon and an artificial satellite of earth, Weightlessness is experienced by a person _________",on the moon as well as the artificial satellite.,only in the artificial satellite.,only in the moon,neither on the moon nor in the artificial satellite ,
Dynamics,Assessment Test II,8,"What is the percentage change in the momentum of the body, if the mass of a body is doubled and its velocity is redued by half?",0%,10%,50%,100%,
Dynamics,Assessment Test II,9,"Two bodies A and B moving towards each other along a straight line, coalesce after collision. The system will move in the initial direction of A, if ________.",the velocity of A is more than the that of B before collision ,mass of A is more than that of B.,acceleration of A is more than that of B,the momentum of A is more than that of B before collision.,
Dynamics,Assessment Test II,10,"A body 'A' of mass 5 kg moving with velocity of 5 ms-1 collides with a body B initially at rest and bounces back along same line with a velocity of 2 ms-1 What is the force exerted on body B by A (in N), if the collision takes place for 0.1 milli second?",20 x 104,30 x 104,35 x 104,40 x 104 ,
Dynamics,Assessment Test II,11,A body of mass 1 kg is accelerated from rest to 2 ms-1 in 1 s. work done on it in 5 s is __________ joule.,50,8,0.4,10,
Dynamics,Assessment Test II,12,"A certain quantity of mercury is present in a cylindrical vessel of cross section area 'A' upto a height , h. The mercury is then transferred to another cylindrical vessel of cross sectional are 2A. What is the shift in the centre of gravity of mercury with respect to the base of the cylindrical vessels?",h,h/2,2/3 h,h/4,
Dynamics,Assessment Test II,13,"A spring balance is used to weight an object of mass M kg hanged from the centre of a level as shown in figure. What is the mass of the object (in kg), if the reading shown by the spring is 60 kg wt and the level is in equilibrium? (g=10 m s-2)",100,200,150,175,X
Dynamics,Assessment Test II,14,"If the efficiency of a pulley system having four pulleys is 80%, then calculate its mechanical advantage.",2..0,4..0,1.6,3.2,
Dynamics,Assessment Test II,15,A rectangular cuboid whose face ABCD shown with measurements in the figure is cut into two halves diagonally (along AC or BD) and the lower-half portion is used as an inclined plane. What is the mechanical advantage of the inclined plane formed?,3 3/5,2 2/5,2 3/5,5 2/3,
Dynamics,Assessment Test III,1,Friciton in parts of a machine can be reduced by using _______,iron filings,lubricants,ball bearings,both (b) and (c ),
Dynamics,Assessment Test III,2,"When a fast moving bus is stopped suddenly, the passengers sitting in it tend to fall forwards. This is due to _______.",inertia of rest,inertia of motion ,inertia of direction ,inertia of speed,
Dynamics,Assessment Test III,3,What is the work done to lift a body of mass 5 kg to a height of 50 m from the ground (in j)? (g=10 m s-2),250,2.5 X 1010,2.5 X 1010 ,2.5 X 10-4,
Dynamics,Assessment Test III,4,A machine is operated by an effort of 25 N and the effort has a downward displacement of 2.5 m in raising a load of weight 100 N through 10 cm. What is the efficiency of machine (in %)?,250,40,25,16,
Dynamics,Assessment Test III,5,Forceps is an example of ___________ order lever.,1,2,3,1 or 2,
Dynamics,Assessment Test III,6,1 N of force is equal to _________ dyne.,10 4,10.-7,10.-5,105,
Dynamics,Assessment Test III,7,A constant force for 100 N acts on a body for 8 s for changing its momentum. What is the change of momentum of the body (in N) ?,400,800,200,100,
Dynamics,Assessment Test III,8,The power delivered by a machine if it lifts an object of mass 1000 kg to 4m height in 1 minute is _____ kW,0.7,466,666.6,66.66,
Dynamics,Assessment Test III,9,"Match the statements of Column A with those of Column B.
(P) Newton's first law            (p) F = ma
(Q) Newton's second law      (q) Recoil of a gun
(R ) Newton's third law          (r ) Law of inertia","P →q;    Q→r,     R→p","p →P;    Q→r,     R→q","p →r;    Q→P,     R→q","P →q;    Q→p,     R→r",
Dynamics,Assessment Test III,10,"A car of mass 1500 kg moving at a speed of 90 km h-1 collides with another car at rest. After collision, both have a common velocity of 50 km h-1. The mass of the car which is initially at rest is ________ kg.",1100,1200,1300,1400,
Dynamics,Assessment Test III,11,The physics teacher gave a rod of length 'l' units to Ram and the teacher asked Ram to find the shift in the C.G. when 1/5 of the total length of the rod is removed. The anwer of Ram will be _______ units,0.4 l ,0.2 l,0.8 l,0.1 l ,
Dynamics,Assessment Test III,12,"A crow bar of length 1.14m is used to move a block of mass 100 kg wt. If the effort arm is 100cm when it is used as I-order lever, then the minimum effort required to move the block is ________ milli dyne. (Take = 10 ms-2)",1.4 x 1010,1.4 x 108,140,1.4 x 105,
Dynamics,Assessment Test III,13,"A system of pulleys is used to lift a load of 500 kg wt. If the velocity ratio and M.A. are 0.9 and 5, then the efficiency and effort required to lift the load are ______ and _______, respectively.","5.6, 105 N","5.6, 108 dyne","2.6, 107N","2.6, 107 dyne",
Dynamics,Assessment Test III,14,"A car moving at 54 km h-1 is to be stopped by applying brakes in the next 5m. If the can weights 1800 kg wt, then the next external force acting on it is ______.",4 x 109  N,40 N,4 x 104  dyne,4 x 104  N,
Dynamics,Assessment Test III,15,"Write the steps in sequential order to determine the difference in the height of C.G. of  a solid right circular cone of height 40cm resting on its base and a solid cylinder of length 1 m and diameter 30 cm resting on its lateral surface.
(A) Find the difference between the height of C.G. from the base.
(B) Determine the height of the C.G. from the base.
(C) Note down the height of the solid cone and the diameter of the sphere.",ABC,BCA,ACB,CBA,
Dynamics,Assessment Test IV,1,Frictional force in a machine can be reduced by _________.,using iron filings,lubricants,converting sliding motion into rolling motin ,both (b) and (c ),
Dynamics,Assessment Test IV,2,Inertia is measured by _______ of the body.,momentum,mass ,volumne,density,
Dynamics,Assessment Test IV,3,"If the work done to move a body a mass 6 kg to a height h is 4.8 x 109 erg, then h = ________ m. (take g = m s-2)",8,8 x 102,8 x 103,8 x 107,
Dynamics,Assessment Test IV,4,"A machine is operated with an effort of 50 N in raising a load of weigth (W). What is the load, if the mechanical advantage is 2 ?",500 dyne,5 N,100 N,5 dyne,
Dynamics,Assessment Test IV,5,The human hand is a III - order lever because _______ lies between fulcrum and ______.,"effort, elbow","effort, load","load, effort","elbow, effort",
Dynamics,Assessment Test IV,6,The unit of impulse is same as the unit of _______.,weight,force,momentum,work,
Dynamics,Assessment Test IV,7,"If the change in momentum of a body is 400 N s, then constant force applied on the body for 10 s is _____ kilo dyne.",40,40 x 102,40 x 103,4 x 102 ,
Dynamics,Assessment Test IV,8,"If the power delivered by a machine if it lifts an object of mass 2000 kg to 6 m height is 2000 W. Then, time taken by the machine is ______ min. (g = 10 ms-2)",1,2,3,4,
Dynamics,Assessment Test IV,9,"Match the entries of Column A with those of Column B.
(P) Balanced force          (p) An apple falling down
(Q) Unbalanced force      (q) Friction
(R ) Contact force           (r ) A book resting on the table","P →q;    Q→p,     R→r","P →p;    Q→q,     R→r","p →r;    Q→q,     R→p","P →r;    Q→p,     R→q",
Dynamics,Assessment Test IV,10,A car of mass 1200 kg moving at a speed of 72 km h-1 collides with another car  of mass 1500 kg which is at rest. What is the common velocity of the two cars. If they move togeter after the collision (m s-1)?,32.04,3.204,8.9,89,
Dynamics,Assessment Test IV,11,The shift in the C.G. of rod is 5 cm when 1/4 of the rod is removed. The original length of the rod is _______ m.,0.75,0.125,0.4,40,
Dynamics,Assessment Test IV,12,"A system of pulleys is used to lift a load of 1000 kg wt. If the velocity ratio and efficiency are 20 and 90%, respectively, then the effort required to lift the load is______ N.",5.6 x 107,5.6 x 10-3,5.6 x 103,560,
Dynamics,Assessment Test IV,13,"A crow bar of length 120 cm is used to move a block of weight 1000 N. If the load arm is 30 cm when it is used as a II-order lever with maximum mechanical advantage, then the minimum effort required is _________N.",2.5 x 107,4,250,2.5 x 10-3,
Dynamics,Assessment Test IV,14,"A car moving at 40 km h-1 is to be stopped by applying brakes in the next 4.0 m. If the average resultant force on it is 3.1 x 104 N, then mass of the car is ______kg.",2009,2500,1500,1600,
Dynamics,Assessment Test IV,15,"A brick of dimentions 12 cm x 6 cm x 3 cm is resting on its larger area and a cylinder of length 'l' is resting on its circular plane are. Arrange the following steps in the correct sequence to determine the value of 'l' if the diffrence in the height of center of gravity is 15.5 cm.
(A) Find the center of gravity of the brick and cylinder.
(B) Note the dimentions of the brick and the diffrence in the height of center of gravity.
(C) Find the valuse of difference in the height of center of gravity.
(D) Equate it with the given value and find l. ",BACD,ACBD,BCAD,BDAC,
Wave Motion and Sound,Assessment Test I,1,"Assertion (A) : It is not possible to take directly a person on the surface of the Moon.
Reason (R ) : Sound waves are mechanical waves.",A and R are true and R is the correct explanation of A.,A and R are true and R is correct explanation of A.,A is true but R is false.,Both A and R are false.,
Wave Motion and Sound,Assessment Test I,2,"Mach the statements of Column A with those Column B
(A) Mechanical wave          (p) Crests and troughts
(B) Non mechanical wave   (q) Compression and rarefactions
(C ) Longitudinal wave       (r ) Light
                                          (s) Ripples","A→s;    B→r,    C→p;     D→q","A→s;    B→r,    C→q;     D→p","A→r;    B→s,    C→p;     D→q","A→p;    B→r,    C→q ;     D→s",
Wave Motion and Sound,Assessment Test I,3,"Arrange the following incidents in the decreasing order of time taken. 
(A) The sound produced under a liquid at a depth of 100 m to reach the surface of liquid if the velocity of sound in the given liquid is 1500 m s-1.
(B) A wave of frequency 100 Hz and wave length 2 m to travel through a distance of 50 m.
(C ) A second pendulum to complete 50 oscillations.
(D) Light to reach on the surface of earth from the sun. [ Distance between the sun and the earth is approximately 1496 x 103 km]",CDBA,ABCD,ACBD ,DCBA,
Wave Motion and Sound,Assessment Test I,4,"Time period of a pendulum changes ___________
(A) when the work done to osciallate the pendulum is changed.
(B) when the bob is immersed in water.
(C ) when the mass of the bob is increased.
(D) when weight of the pendulum is increased without changing its mass.","B, C and D",B and D,"A, B, C and D","A, B and D",
Wave Motion and Sound,Assessment Test I,5,Sound produced by a tuning fork travels from air to glass. Which of the following physical quantities remains the same?,Velocity,Frequency,Wavelength,Amplitude,
Wave Motion and Sound,Assessment Test I,6,"If V1 and V2 are the velocities of sound in solid and liquid, respectively, then V1/V2.",≤ 1,> 1,<1,1,
Wave Motion and Sound,Assessment Test I,7,The time period of a pendulum of length 'l' and mass of the bod 'm' is T. The time period of a pendulum with mass of the bob 2m and length l is _________.,T,2T,3T,4T,
Wave Motion and Sound,Assessment Test I,8,"When a simple pendulum oscillates with a small smplitude 'a' its time period is T. What is its time period, when it oscillates with a small amplitude 2a?",T,2T,4T,8T,
Wave Motion and Sound,Assessment Test I,9,"If the velocity of a wave is 200 m s-1 and the time period of its sourceis 0.001s, then its wave length is _____________.",2 m,20 cm,2 cm,2 mm,
Wave Motion and Sound,Assessment Test I,10,"The frequency of vibration of a pendulum is 'n'. What is its time period, if the length of the pendulum is doubled?",√‾2 n,√‾2/ n,√‾n/ 2,2√‾n,
Wave Motion and Sound,Assessment Test I,11,The displacement time graph of a simple pendulum is shown below. Calculate its frequency in Hz.,0.01,2,0.3,0.25,X
Wave Motion and Sound,Assessment Test I,12,Which of the following statements is incorrect?,Sound requires a material medium to travel.,Sound waves are mechanical waves.,Sound waves are produced by vibrating bodies,Sound waves have the maximum velocity among all the waves.,
Wave Motion and Sound,Assessment Test I,13,Sound of a thunder is heard 't' s after the flash of lightning is seen. Determine the distance of the cloud from the ground if velocity of sound is v m s-1 (Neglect the time take for the light to travle),v / t,vt,t/v,v + t,
Wave Motion and Sound,Assessment Test I,14,"The frequency of two tuning forks A and B are 200 Hz and 100 Hz, respectively. What is the ration of the velocity of sound, when the sound is propagated through a given medium?",  2 : 1,  1 : 2,  1 : 1,  4 : 1,
Wave Motion and Sound,Assessment Test I,15,"If length of a pendulum of time period T is doubled, its frequency is ________.",1/ √‾2T,1 / T,√‾2T,2 T,
Wave Motion and Sound,Assessment Test II,1,"Assertion (A) : A person standing at equal distances from a source of sound which is placed in water and another source which is placed in air. If sound is produced by both the sources, the sound produced in the water is heard first.
Reason (R ) : The speed of sound in liquid is more than that is gases. ",A and R are true and R is correct explanation of A.,"A and R are true, but R is not the correct explanation of A.",A  is true but R is false.,Bothe A and R are false.,
Wave Motion and Sound,Assessment Test II,2,"Mathc the statement of Column A with those of Column B
(A) Velocity of wave           (p) Velocity x Time period
(B) Frequency of a wave     (q) Number of waves / time taken
(C ) Wave length                 ® Depends on source
(D) Frequency                    (s) Depends on medium","A→p;    B→q,    C→s;     D→r","A→s;    B→r,    C→q;     D→p","A→r;    B→s,    C→p;     D→q","A→s;    B→r,    C→p ;     D→q",
Wave Motion and Sound,Assessment Test II,3,"Arrange the following incidents in the increasing order of frequency of occurrence.
(A) Oscillaitions of a seconds pendulum.
(B) Rotation of the Earth in its own axis.
(C ) Sound waves produced in air from a siren. [Given velocity of sound through air 340 m s-1 and wave length is 2cm].
(D) Waves to reach the sea shore. [Give time interval between two waves to reach the sea shore is 10 s]",ABDC,DBAC,BDAC,CBDA,
Wave Motion and Sound,Assessment Test II,4,"Frequency of oscillation of pendulum changes with __________
(A) time period
(B) amplitude
(C ) length of the pendulum
(D) mass of the bob",A and C,"A, C and D",B and C,"B, A and C",
Wave Motion and Sound,Assessment Test II,5,"As the sound propagates throught a medium, its _________ changes.",Velocity,wavelength,frequency,Amplitude,
Wave Motion and Sound,Assessment Test II,6,"Sound produced by a tuning fork travels through a solid and liquid media. If f1 and f2 are the frequencies of sound in solid and liquid, then find the valud of f1/f2.", = 1,>1,≥ 1,< 1,
Wave Motion and Sound,Assessment Test II,7,"What is the new time period of a pendulum, if the length of a pendulum of time period T is doubled?",T2,√‾ 2T,2T2,4T,
Wave Motion and Sound,Assessment Test II,8,"If a pendulum make 2 oscillations per second, its time period is _________ s.",2,5,0.2,0.5,
Wave Motion and Sound,Assessment Test II,9,"If the velocity of sound wave 330 m s-1 and the frequency of oscillations is 10 Hz, then the distance between and adjacent compression and rarefaction is _________ m.",33,16.5,66,44,
Wave Motion and Sound,Assessment Test II,10,"What is the time period a body, if the frequency of a body is equal to the minimum value of the audible range of frequency?",0.05,0.5,0.2,2,
Wave Motion and Sound,Assessment Test II,11,"From the graph shown below, determine the amplitude of oscillation.",80 cm,40 cm,20 cm,10 cm,X
Wave Motion and Sound,Assessment Test II,12,"To increase the frequency of oscillation of a pendulum, its __________",length should be increased.,length should be decreased.,time period should be increased.,amplitude should be increased.,
Wave Motion and Sound,Assessment Test II,13,Sound cannot travel through_______,solid,liquid,gas,vaccum,
Wave Motion and Sound,Assessment Test II,14,The time taken to complete 100 waves is 50s. The frequency of the wave is __________Hz.,1,2,0.5,5,
Wave Motion and Sound,Assessment Test II,15,"Sound produced by a source travels through two different media. If the ratio of the velocity of sound waves travelling through the media is 1 : 3, then ratio of the wavelength is ____________",   1 : 3,  3 : 1,  6 : 5,  9 : 1,
Wave Motion and Sound,Assessment Test III,1,"Write down the steps to verify the third law of simple pendulum in a proper sequence.
(A) Arrange a pendulum and determine its length.
(B) Set the pendulum into oscillation and determine the time taken for 20 oscillations.
(C ) Determine the time period of oscillation and determine the time taken for 20 oscillations.
(D) Change the length of simple pendulum and repeat the experiment.
(E) Note the value of l / T2 in each case.",CDBAE,ABCDE,CDABE,ABCED,
Wave Motion and Sound,Assessment Test III,2,"If the distance between two successive troughs is 20 cm, then the distance between one of the crests to next trough is _________.",10 cm,20 cm,40 cm,50 cm,
Wave Motion and Sound,Assessment Test III,3,An example for flute type instrument is _______,clarinet,piccolo,oboe,bassoon,
