ChapterName,TestNumber,QuestionNumber,QuestionDescription,Option1,Option2,Option3,Option4,Image?
Measurements and Kinematics,Assessment Test I,1,"Asserattion (A) : The mass of body decreases as it moves to higher altitudes.
Reason ( R) : The value off a g decrease as we move to higher altitudes.",A and R are true and R is the correct explanation of A.,"A and R are true, but R is not the correct explanation of A.",A is true but R is false,Both A and R are false,
Measurements and Kinematics,Assessment Test I,2,"Asserattion (A) : The SI unit of acceleratin is m  s-2  
Reason ( R) : Acceleration is the rate of change in velocity.",A and R are true and R is the correct explanation of A.,"A and R are true, but R is not the correct explanation of A.",A is true but R is false,Both A and R are false,
Measurements and Kinematics,Assessment Test I,3,"Arrange the following steps in the proper sequences to calculate the volume of an irregular-shaped stone.
(A) Immerse the stone intto the vessel and note the difference in the volume of the liquid.
(B) Take a stone (irregular shaped) and a measuring cylindrical jar.
(C) Pour a liquid like water into the jar and note the volume of the liquid.
(D) The volume of the stone is equal to the increase in the volume of the liquid.",ABCD,BCAD,DBCA,DCBA,
Measurements and Kinematics,Assessment Test I,4,"A hockey player hits the ball moving with a speed of 50 m s-1 in its same direction. 
Because of this the velocity increases to 60 m s-1  in 0.1s. 
Arrange the following steps in sequential order to calculate the acceleration of the ball.
(A) Find the initial volicity of the ball and the velocity of the ball at the end of 0.1s. After it is being hit.
(B) Write down the required equation of motion as υ = u+at, where υ, u, a and t are final velocity, initial velocity, acceleration and time, respectively.
(C) Substitute the given values in the above equation and obtain the value of a.
(D) Get the value of a as υ = u(υ- u)/1",ABCD,BDAC,DBAC,ADBC,
Measurements and Kinematics,Assessment Test I,5,"Match the statements of Colums A with those of Column B
(A) Physical quantity          (a) Volume of a drop of liquid
(B) Burette                         (b) Measurable Quantity
(C) Instataneous speed       ( c) Rate of change of velocity
(D) Acceleratio                   (d) m s-1",A →b;  B→a;  C→d;  D→c,A→a;  B→b;  C→c;  D→d,A→d; B→c; C→b; D→a,A→d; B→c; C→a; D→b,
Measurements and Kinematics,Assessment Test I,6,"For a given vernier caliper, one M.S.D.= 1/10 cm and the number of divisions of vernier scale is=20. What is 
the least count of the vernier caliper ?",0.05cm,0.5mm,0.05mm,0.02cm,
Measurements and Kinematics,Assessment Test I,7,One Centimeter of main scale of  vernier caliper is divided into 10 equal parts. M.S.R. and V.C.D. observed while measuring the length of the object is ______mm. (Take number of ,4.3,3.4,3.04,4.03,
Measurements and Kinematics,Assessment Test I,8,The CGS unit of average speed is ___________,m s-1,cm s-1,ft s-1,km h-1,
Measurements and Kinematics,Assessment Test I,9,The density of gold is 19 g  .Then the rrelattive density is ___________.,19/1000 kg m,19000 kg m-1,19,19/1000,
Measurements and Kinematics,Assessment Test I,10,"A car is moving with 120 km h-1. On seeing a speed breaker, the driver applies the brakes and stops the car in 4s. What is the value of the deceleration produced in the car is _________ m s-1",175/5,8 1/3,25/3,25/3,
Measurements and Kinematics,Assessment Test I,11,An athlete completes running track of length 330 m in 40 s and comes back to his original position. Find the average velocity of the athlete.,5 m s-1,0 m s-1,33/4 ms-1,33/2 ms-1,
Measurements and Kinematics,Assessment Test I,12,"An aeroplane is moving with a uniform velocitty of 800km h-1, then its _________.",average velocity is 800 km h-1,instantaneous velocity is 800 km h-1,acceleration is zero,displacement is zero,
Measurements and Kinematics,Assessment Test I,13,A car travel the first hour with 50 km h-1 and the second hour with 100 km h-1. What is the average speed of the car ?,120 km h-1,100 km h-1,150 km h-1,75 km -1,
Measurements and Kinematics,Assessment Test I,14,"A body travel 100 m in 10 s. Then,
(A) the average velocity of the body is 10 ms-1 only when the body travels in a straight path.
(B) the average speed of the body is 10 ms-1 irrespective of its direction of motion.",Only A is true.,Only B is true,Both A and B are true.,Both  A are B are false.,
Measurements and Kinematics,Assessment Test I,15,A bus starts from the rest and moves with uniform accelerration 2 ms -2 for 10 s. The average velocity of the bus is ___________,10 ms-1,20 ms -1,0 ms -1,40 ms-1,
Measurements and Kinematics,Assessment Test II,1,"Asseration (A) : The mass of a body remains the same everywhere in the universe
Reason ( R) Mass is the inherent property of the body.",A and R are the true R is the correct explanation of A.,"A and R are true, R is not the correct explanation of A.",A is true but R is false.,Both A and R are false.,
Measurements and Kinematics,Assessment Test II,2,"Asseration (A) : The average speed of the vehicle is equal to the average velocity of the vehicle
Reason ( R) The vehicle is moving in a straight path.",A and R are the true R is the correct explanation of A.,"A and R are true, R is not the correct explanation of A.",A is true but R is false.,Both A and R are false.,
Measurements and Kinematics,Assessment Test II,3,"Arrange the following steps in the proper sequences to find the radious of a metalic sphere using standard vernier caliper.
(A) Note M.S.R and V.S.R from the given data.
(B) Place the metalic sphere between the jaw of a vernier caliper.
( C) Here daimeter, (D)= M.S.R.+ ( V.S.R x L.C)
(D) Substitute the values and obtain the diameter of the sphere.
(E) The radius of the metalic sphere is equal to half the diameter.",BACDE,EABCD,AEDCB,DECAB,
Measurements and Kinematics,Assessment Test II,4,"An MMTS train moving with 90 km-1 speed retards uniformly and comes to a halt by covering 200m. Arrange the following steps in sequential order to calculate the time taken by the train to comde to a halt.
(A) Substitute the value of u,v and s in the above formula.
(B) Write down the given data and convert the values into SI system of unit.
( C) Write the equation of motion u+v/2 =s/t, where u,v,s and i are initial velocity, final velocity, displacement and time taken, respectively.
(D) Obtain the value of t.",DABC,BCAD,BCDA,CABD,
Measurements and Kinematics,Assessment Test II,5,"Match the statement of Column A with those of Column B.
(A) Derived quantity                               (a) Ampere (A)
(B) Displacement                                    (b) Hardware shop
( C) Roman steel yard                             ( c) Vector quantity
(D) Fundamental unit                              (d) Velocity.",A→d; B→c; C→b; D→a,A→a; B→d; C→d; D→c,A→b; B→a; C→d; D→b,A→b; B→d; C→a; D→c,
Measurements and Kinematics,Assessment Test II,6,"While measuring the length of an object, using vernier caliper, the M.S.R and V.C.D. were observed to be 22 and 8, respectively. If M.S.D. =1/2 mm and L.C = 0.05 mm, the length of the object is ________.",0.14,1.14 mm,11.4 mm,11.4 mm,
Measurements and Kinematics,Assessment Test II,7,"In a vernier caliper, 2 cm on main scale is divided into 20 equal parts and 1V.S.D is equal to 0.9 mm. What is the least count of the vernier caliper ?",0.1cm,0.1mm,1 mm,0.01 mm,
Measurements and Kinematics,Assessment Test II,8,The CGS unit of amount of substance of _______.,Mol,Kelvin,Candela,non- exitent,
Measurements and Kinematics,Assessment Test II,9,A stone of density 6 g cm-3  can be used as a sinker in a liquid of density_________.,11X 103 kg -3,7 g cm-3,2000 kg m-3,6000 kg m-3,
Measurements and Kinematics,Assessment Test II,10,A ball is rolling with a velocity 20 ms -1 on a cement floor and stops in 10s. What is the acceleration produced in the ball ?, -20 m s-2, - 200 m s-2, -2 m s-2, + 20 m s-2,
Measurements and Kinematics,Assessment Test II,11,A fan blade of length 1/3m moving with uniform velocity makes 1000 rotations in 20s. Calculate the average velocity of the fan at the end of 20s.,0 m s-1,50 m s-1,50 π m s-1 ,1/3  π m s-1,
Measurements and Kinematics,Assessment Test II,12,"A toy car moves along the length and breadth of a rectangle as shown in the figure given below. If the length of the rectangle is 4m, then find the ratio of displacement to distance covered by the car.",,,,,X
Measurements and Kinematics,Assessment Test II,13,"A cyclist moves the first-half of the distance with 10 km-1 speed and the second-half of the distance with speed V km h-1. If the average speed of the cycle is 15 km-1 , then the value of V  is ________km h-1  ",5      ,15      ,20      ,30      ,
Measurements and Kinematics,Assessment Test II,14,"A body is moving in a stright path, Then,",its instantaneous speed is equal to its instantaneous velocity,its average speed is equal to its average velocity,its acceleration is equal to change in its velocity,Both (a) and (b),
Measurements and Kinematics,Assessment Test II,15,"A person starts from his house on his bike at 9.a.m and returns to his house and at 8.p.m. If the odometer reading at 9 a.m. is 4700 km and the average speed of the bike is 20 km h-1, then the odometer reading of the bike at 8p.m is km.",4900,4920,4970,4810,
Measurements and Kinematics,Assessment Test III,1,Which of the following physical quantities has Candela as its unit ?,Amount of substance ,Temperature,Luminous intensity,Electric current,
Measurements and Kinematics,Assessment Test III,2,What is the least count of a vernier caliper whose 1 M.S.D is 1mm and 20 V.S.D. = 19mm,0.1 mm,0.01 mm,0.05 mm,05. mm,
Measurements and Kinematics,Assessment Test III,3,Which of the following is true with respect to standard vernier calipers?,N vernier scale divisions = (N-2) main vernier scale divisions.,N vernier scale divisions = (N +1) main vernier scale divisions.,N vernier scale divisions = (N -1) main vernier scale divisions.,N vernier scale divisions = (N ) main vernier scale divisions.,
Measurements and Kinematics,Assessment Test III,4,"If the relative density of ice is 0.9, its density is ________ kg m-3",0.9,900,9000,9,
Measurements and Kinematics,Assessment Test III,5,"When 20 drops of a liquid are drained from a burette, the initial and final volumes of the liquid are found to be 10 mL and 50 mL, respectively. What is the volume of 1 drop of the liquid ?",0.5 mL,1mL,4 mL,2 mL,
Measurements and Kinematics,Assessment Test III,6,The unit of pressure is pascal in SI system. If 1 pascal is equal to 1 kg m-1s-2.,10,100,1000,1,
Measurements and Kinematics,Assessment Test III,7,"Match the statements of Column A with those of Column B.
(A) Length                    (p) ampere
(B) Electric current      (q) year
( C) Time                      (r ) mile",A →q; B→p; C→r;,A→p; B→q; C→r,A→r; B→p; C→q,A→q; B→r; C→p,
Measurements and Kinematics,Assessment Test III,8,"An object of volume 100 cm3 and another of volume 150 cm3, when placed on either sides of a physical balance, balance each other. Find the ratio of their densities.",03/May,03/Feb, 1/5,01/Feb,
Measurements and Kinematics,Assessment Test III,9,Find the area of shaded region in the figure given below.,11.86 cm2,9.8 cm2,17.232,23.812,X
Measurements and Kinematics,Assessment Test III,10,"The viscous force in case of a liquid is given by, F-nA v/x. Where A=area, v = velocity, x= distance and n is a constant. What is the unit of n?",N m s-1,N m-2  s-1,N m-2 s,N m3  s-1,
Measurements and Kinematics,Assessment Test III,11,"A cylinder of unknown radious was held between the lower jaws of a vernier caliper. The main scale is divided into milimeters and vernier scale has 20 divisions. 
The vernier coinciding division is 16. If the zeroth divison of the vernier scale lies between 12.3 cm and 12.4 cm of the main scale, the radious is ______mm.",41.9,61.9,81.8,88.5,
Measurements and Kinematics,Assessment Test III,12,"The SI unit of a physical quantity is kg m s-2,  then the ratio of SI and CGS unit of the quantity is______.",14/Apr,105,102,105,
Measurements and Kinematics,Assessment Test III,13,"If the principle used to construct a vernier caliper is N V.S.D = (N-2) M.S.D., its least count is _______mm. (1M.S.D = 1mm and N =10)",0.1,0.01,0.2,0.3,
Measurements and Kinematics,Assessment Test III,14,"When an object is immersed into water, the volume of the water displaced is 200 cm3. What is the relative density; if the mass of the object is 400 g?",2,0.5,40,8,
Measurements and Kinematics,Assessment Test III,15,"When an object is placed between the jaws of a vernier caliper, the zero of the vernier scale is found to be on the right of 7th division of the main scale. The 8th division of the vernier scale is found to coincide with one of the divisions of main scale. Arrange the following steps in sequential order to determine the length of the object. [1M.S.D.= 1mm, number of V.S.D=10]
(A) Dertermine the length of the object.
(B) Use the formula M.S.R + V.C.D x L.C
(C) Note the M.S.R., V.C.D., 1 M.S.D. and number of V.S.D.
(D) By using the information given determine the least count.",ACBD,CDBA,DBCA,ACDB,
Measurements and Kinematics,Assessment Test IV,1,The speedometer of a vehicle indicates its __________.,instantaneous speed,average speed,instantaneous velocity,average velocity.,
Measurements and Kinematics,Assessment Test IV,2,Calculate the value of 5 m s-1 in km h-1.,10,1.38,18,3.6,
Measurements and Kinematics,Assessment Test IV,3,"If a body is moving with uniform velocity, then its acceleration is ________.",uniform,negative,positive,zero,
Measurements and Kinematics,Assessment Test IV,4,The slope of displacement-time graph is________.,velocity,speed,acceleration,distance,
Measurements and Kinematics,Assessment Test IV,5,"Asseration (A) : Velocity is a vector.
Reason ( R) Velocity has both magnitude and direction.",A and R are true and R is the correct explanation of A,"A and R are true, R is the correct explanation of A.",A is true but R is false.,Both A and R are false.,
Measurements and Kinematics,Assessment Test IV,6,"Match the statements of Column A with those of Column B.
(A) Uniform velocity Derived quantity             (a) Total distance / time
(B) Average speed                                              (b) m s-2
( C) Average velocity                                         (c) Acceleration is zero
(D) Acceleration                                                 (d) Ratio of toal displacement to total time taken",A→c;  B→a;  C→d;  D→b,A→a;  B→c;  C→b;  D→d,A→c;  B→a;  C→b;  D→d,A→a;  B→b;  C→c;  D→d,
Measurements and Kinematics,Assessment Test IV,7,A car starts from rest and moves along a straight line with an acceleration of 6 m s-2. The displacement of the car in forth second is _________m.,48,21,0,20,
Measurements and Kinematics,Assessment Test IV,8,8 m towards west and then moved 13 m  towards east. What is the total distance travelled and the magnitude of displacement ?,8 m and 8 m,21 m and 5 m,21 m and 8 m,21 m and 13 m,
Measurements and Kinematics,Assessment Test IV,9,"A person on a rotating platform of radious7m, makes 3 ritatuibs 10 4 min. What is the magnitude of the displacement of the person (in m) ?",28,0,14,176,
Measurements and Kinematics,Assessment Test IV,10,A boy kicks a football horizontally from the end roof of a building of height 6m. If the line joining the initial position ,6,6,,,
Measurements and Kinematics,Assessment Test IV,11,A car moving with a constant acceleration covers 24 m in 4 s and 21 m in the next 2 s. What is the initial velocity of the car ?,3 km h-1,3 m s-1,1.5 km h-1,1.5 m s -1,
Measurements and Kinematics,Assessment Test IV,12,"A car starts moving with uniform acceleration form its position of rest and it moves 100m in 10 s. On applying brakes, it stops after covering 50 m. Then magnitude of acceleration in the second part of its motion is ________.",20,200,40,4,
Measurements and Kinematics,Assessment Test IV,13,which of the following graphs is impossible with respect to velicity-time graph?,x,x,x,x,x
Measurements and Kinematics,Assessment Test IV,14,A passenger is at a distance 10 m from a bus when the bus starts with a constant acceration of 0.1 m s-1. The velocity with which the passenger should run towards the bus so as to catch the bus in 30 s is ________.,2.5 m s-1,2 m s-1,3.5 m s-1,1.83 m s-1,
Measurements and Kinematics,Assessment Test IV,15,"Starting from rest a car moves with a uniform acceleration and attains a velocity of 10 m s-1 in 10 s. It then moves with uniform speed for 15 s and is then brought to rest in 12 s under uniform retardation. Arrange the following steps in sequential order to find the total distance covered using v-t graph.
(A) Add the area of traingles and rectangles
(B) Find the area under traingles and rectangles.
(C) Draw the velocity-time graph by using the information given in the question.
(D) Divide the graph into triangles and rectangles.",ACBD,CDAB,BACD,CDBA,
Measurements and Kinematics,Assessment Test V,1,Which of the following is the SI unit of luminous intensity ?,Gram,Mole,Candela,Kelvin,
Measurements and Kinematics,Assessment Test V,2,"Determine the number of vernier scale divisions required for a vermier caliper, so that the least count is 0.05 mm (I M.S.D.= 1 mm)",40,30,10,20,
Measurements and Kinematics,Assessment Test V,3,Which of the following is incorrect with respect to a standard vernier caliper ?,L.C = 1 M.S.D/N,L.C= 1M.S.D.- 1 V.S.D,L.C= 1 M.S.D/ 1 V.S.D,1 M.S.D.=1mm,
Measurements and Kinematics,Assessment Test V,4,"If the relative density of iron is 5, its density is ________ g cm-3.",5,5000,500,50000,
Measurements and Kinematics,Assessment Test V,5,"The volume of a drop of a liquid is 0.3 mL. When 30 drops of the liquid are drained, the level of the liquid in the burrette is found to be 50 mL. What is the initial level of the liquid ?",150 mL,59 mL,50 mL,200 mL,
Measurements and Kinematics,Assessment Test V,6,The unit of momentum is SI system is kg m s-1. Then 1 SI unit of momentum is equal to ________ CGS unit of momentum.,10 2,10 3,10 4,10 5,
Measurements and Kinematics,Assessment Test V,7,"Match the statements of Column A with those of Column B.
(A) amu                       (p) foot
(B) Time                      (q) unit of mass
( C) Length                  ( r) day",A→p;  B→q;  C→r,A→r;  B→p;  C→q; ,A→q;  B→r;  C→p,A→p;  B→r;  C→r,
Measurements and Kinematics,Assessment Test V,8,"When two objects A and B are separately dropped into the water, the volume of water displaced is found to be the same. What is the ratio of the densities; if the masses of A and B are in the ratio 2:3, respectively ?",02:03,03:02,03:01,01:03,
Measurements and Kinematics,Assessment Test V,9,Find the area of unshaded region in the figure given below,85.3 cm2,64.3 cm2,175.5 cm2,108.3cm2,
Measurements and Kinematics,Assessment Test V,10,"The expression for a physical quantity is T/µ, where T= Force and µ=mass/length. What is the physical quantity ?",mass,speed,time,distance,
Measurements and Kinematics,Assessment Test V,11,"1 M.S.D. of a vernier caliper is 1 mm and number of vernier scale divisions is 40 and the vernier coinciding divisioin is 28. What is the length of the object, if zeroth division of the vernier scale lies between 11.2 cm and 11.3 cm?",1137,112.7,142.8,11.3,
Measurements and Kinematics,Assessment Test V,12,"The SI unit of a quantity is kg m2, its CGS unit is __________.",g cm2,g cm-2,g-1 cm-2,g-1 cm3,
Measurements and Kinematics,Assessment Test V,13,"The number of vernier scale division choosen in a vernier calipers in 10, 1 M.S.D.= 1 mm, and the least count is 0.3 mm, then the principle used to design the vernier caliper is _______",(N) V.S.D.= (N-1) M.S.D.,(N) V.S.D = (N-2) M.S.D,(N) V.S.D = (N-3) M.S.D,(N) V.S.D = N  M.S.D,
Measurements and Kinematics,Assessment Test V,14,"When an object floats on the surface of a liquid, half of the volume is immersed into the liquid. If the volume of the liquid displaced by it is 500 cm3 and mass of the object is 500 g, determine the density of the liquid.",1 g cm-3,0.5 g cm-3,2 g cm-3,4 g cm-3,
Measurements and Kinematics,Assessment Test V,15,"The length of an object measured by using a vernier caliper is 6.3 mm. If the V.C.D.=3, 1 M.S.D.= 1mm and N =10, arrange the following steps to determine the main scale reading in proper sequence.
(A) Use the formula, length= M.S.R.+ V.C.D x L.C.
(B) Determine the lease amount.
(C) Note the values of V.C.D., M.S.D AND number of vernier scale divisions.
(D) Determine the M.S.R.",BACD,CBAD,ACBD,BCAD,
Measurements and Kinematics,Assessment Test VI,1,The odometer of a car measure its ________.,speed,distance,displacement,Both (b) and ©,
Measurements and Kinematics,Assessment Test VI,2,18 km h-1 = ________ms-1.,18,5,18000,0.018,18
Measurements and Kinematics,Assessment Test VI,3,"If a body is moving with an increasing velocity, then its acceleration is",negative,positive,zero,None of the above,
Measurements and Kinematics,Assessment Test VI,4,Slope of velocity-time gives __________.,velocity,displacement,speed,acceleration,
Measurements and Kinematics,Assessment Test VI,5,"Assertion(A): Times is a scalar quantity.
Reason ®: Time has both magnitude and direction.",A and R are true and R is the correct explanation of A.,"A and R are true, but R is not the correct explanation of A",A is true but R is false.,Both A and R are false.,
Measurements and Kinematics,Assessment Test VI,6,"Match the statements of Columnn A with those of Column B.
(A) Area under acceleration-time graph              (a) Velocity
(B) Area under velocity-time graph                     (b) Acceleration
 ( C) Slope of velocity-time graph                        (c) Displacement.
",A→a;  B→c;  C→b,A→b;  B→c;  C→b,A→c;  B→a;  C→b,A→c;  B→a;  C→c,
Measurements and Kinematics,Assessment Test VI,7,"If a bus starts from rest, moving along a straight line and travelling with an acceleration of 8 ms-2 then the displacement in the third second is _________m.",3.1,0.32,20,None,
Measurements and Kinematics,Assessment Test VI,8,A particle moved 10 m towards east and then moved 10 m towards north. The magnitude of the displacement and the total distance covered are ______and _________ respectively.,"10√2m, 20m","20m, 20m","20m,10√2m","10m, 20m",
Measurements and Kinematics,Assessment Test VI,9,A person on a merry-go-round of radious 7 m makes 1 1/2 rotations in 4s. What is the average velocity of the person (in ms-1) ?,14,16.5,3.5,3,
Measurements and Kinematics,Assessment Test VI,10,"A boy kicks a football from the top of a building of height  10m. If the line joining the initial position of the football and point where it hits the ground makes an angle of 450 with the ground, then find ",10√2m,20 m,10(1+√2)m,10 m,
Measurements and Kinematics,Assessment Test VI,11,A car moving with constant acceleration of 15 m s2 covers x m in 4 s and 21 m in the next 2 s. The initial velocity of the car is 3 m s-1 . Caluculate the value of x .,2.4 m,24 cm,24 m, 24 cm,
Measurements and Kinematics,Assessment Test VI,12,The velocity-time graph of a body is shown below. Which among the following is the displacement time graph of the body.,x,x,x,x,x
Measurements and Kinematics,Assessment Test VI,13,"A car starts moving with a uniform acceleration from its position of rest and it moves 24 m in 3s. On applying brakes, it stops after covering a distance d. What is the value of d, if its decelrationis 50/9 m s-2", 50/9 m,10 m,20 m,40 m,
Measurements and Kinematics,Assessment Test VI,14,A person is at distance of d m from a bus when the bus starts with a uniform acceleration and attains a velocity of 0.5 m s-2 . The velocity with which the person should run towards  the bus is 1.5 m s-1 to catch the bus in 40s. Find the value of d.,50 m,10 m,20 m,40 m,
Measurements and Kinematics,Assessment Test VI,15,"Starting from rest, a car moves with a uniform acceleration and attains a velocity of 20 m s-1 in 5 s. It thenmoves with a uniform speed for 10 s and is then brought to rest in t seconds under uniform retardation. Arrange the following steps to find t using a v=t graph, if total distance covered is 380m.
(A) Add the area of triangle and rectangle.
(B) Find the area under traingles and rectangle.
(C) Draw the velocity-time graph by using the information given in the question.
(D) Divide the graph into triangles any rectangles.",ACBD,CDBA,CBDA,CABD,
Dynamics,Assessment Test I,1,"Arrange the following steps in sequential order to find the shift in the height of centre of gravity, when a rectagular lamina resting on the longer side is rotated by 900 in vertical plane.
(A) When the rectanugla lamina is resting on longer side, the height of centre of gravity (h) is equal to half of the breadth (b/2) of the rectangel.
(B) Let the dimensions of the rectangular lamina be length (l) and breadth (b).
(C) When the rectangular lamina is rotated by 900 in the vertical plane, it is resting on the shorter side (breadth).
(D)  The shift in the position of centre of gravity is equal to the difference in h and h'
(E)  When the rectangular lamina is resting on the shorter side, the height of centre of gravity (h') is equal to half of the length (l/2) of the rectangle.",BACED,BEDAC,BCADE,BECAD,
